"Ключевое слово";"Слов";"Символов";"Частотность Весь мир";"""!Частотность !Весь !мир"""
"пол детский";2;11;22228;54
"купить детские ковры на пол";5;27;310;64
"интерактивный пол для детского сада";5;35;180;83
"купить мягкий пол для детских комнат";6;36;608;148
"мягкий пол детский";3;18;3146;66
"ковры детские на пол";4;20;1195;123
"мягкий детский пол";3;18;3146;66
"ковер на пол детский";4;20;1195;232
"детские ковры на пол";4;20;1195;123
"детский коврик пазлы на пол";5;27;525;212
"мягкий пол для детских";4;22;3307;108
"коврики детские на пол";4;22;1837;313
"детский ковер на пол";4;20;1195;232
"детский мягкий пол";3;18;3146;66
"мягкий пол для детских комнат купить";6;36;608;148
"детские коврики на пол";4;22;1837;313
"мягкий пол пазл для детских комнат";6;34;153;63
"теплый пол детский";3;18;676;53
"купить ковер на пол детский";5;27;310;55
"пол в детской комнате";4;21;3823;59
"купить детский ковер на пол";5;27;310;55
"ковер детский на пол купить";5;27;310;55
"теплый детский пол";3;18;676;53
"игра детская поле чудес";4;23;272;61
"детский теплый пол";3;18;672;57
"детские ковры на пол купить";5;27;299;60
"ковер на пол детский купить";5;27;310;55
"детская игра поле чудес";4;23;272;61
"детский мягкий пол пазл купить";5;30;197;61
"мягкий пол для детских комнат";5;29;2214;899
"поле чудес детская игра";4;23;272;60
"мягкий пол для детских комнат 1000х1000х20мм";6;44;72;63
"детский ковер на пол купить";5;27;299;53
"высота детской кровати от пола";5;30;68;38
"высота кровати детской от пола";5;30;82;40
"детский пазл пол";3;16;1202;41
"купить коврик детский на пол";5;28;349;39
"36 детская поликлиника октябрьское поле";5;39;47;41
"коврик детский на пол купить";5;28;349;39
"мягкий пол для детских комнат икеа";6;34;51;49
"детский пол пазл";3;16;1202;41
"поликлиника 36 детская октябрьское поле";5;39;48;42
"детская поликлиника 36 октябрьское поле";5;39;47;41
"детский ковер на пол для ползания";6;33;54;50
"детские маты на пол купить";5;26;62;47
"купить детский коврик на пол";5;28;349;39
"пол пазл детский";3;16;1202;41
"детский пол";2;11;22619;52
"детский коврик на пол купить";5;28;338;37
"коврик детский игровой на пол";5;29;147;30
"маты детские на пол";4;19;145;31
"коврик на пол детский";4;21;1837;32
"октябрьское поле частный детский сад";5;36;82;31
"детский пол пазл купить";4;23;401;32
"коврик детский на пол игровой";5;29;147;30
"детский коврик пазл на пол";5;26;525;35
"детский коврик на пол";4;21;1837;32
"мягкий пол в детскую";4;20;3307;33
"детский коврик на пол пазл";5;26;546;31
"коврик детский пазл на пол";5;26;540;36
"детский пазл на пол коврик";5;26;525;35
"детский сад частный октябрьское поле";5;36;82;31
"коврик детский на пол";4;21;1837;32
"коврик пазл на пол детский";5;26;540;36
"детский пазл коврик на пол";5;26;492;29
"коврик теплый пол детский";4;25;81;28
"теплый пол детский коврик";4;25;83;28
"детские маты на пол";4;19;166;29
"коврик детский теплый пол";4;25;81;28
"детские платья в пол";4;20;296;28
"детский теплый пол коврик";4;25;81;28
"платья детские в пол";4;20;284;29
"пол пазл детский купить";4;23;383;28
"пол ка 1 детская";4;16;172;29
"теплый пол коврик детский";4;25;83;28
"платья в пол детские";4;20;284;29
"1 детская пол ка";4;16;172;29
"детский коврик теплый пол";4;25;81;28
"пол ка детская 1";4;16;172;29
"купить детский пол пазл";4;23;403;29
"детская стоматология октябрьское поле";4;37;49;28
"детское поле чудес";3;18;698;22
"детская игра ответ поле чудес";5;29;57;25
"3 детская пол ка";4;16;114;27
"октябрьское поле детская стоматология";4;37;40;25
"мыть пол в детской";4;18;298;25
"поле чудес детская игра ответ";5;29;55;23
"детские коврики пазлы на пол";5;28;525;27
"детская пол ка 3";4;16;106;26
"детский коврик игровой на пол";5;29;143;27
"детская игра поле чудес ответ";5;29;57;25
"детские коврики на пол пазлы";5;28;525;27
"детский игровой коврик на пол";5;29;143;27
"пол для детской комнаты";4;23;3823;24
"игровой детский коврик на пол";5;29;143;27
"коврики детские на пол пазлы";5;28;540;27
"поле чудес детское";3;18;698;22
"детская пол ка 2";4;16;128;20
"мягкий пол для детских купить";5;29;835;20
"играть в поле чудес детское";5;27;111;21
"купить мягкий пол для детских";5;29;835;20
"октябрьское поле детский мир";4;28;53;21
"2 пол ка детская";4;16;135;20
"пол ка 3 детская";4;16;113;22
"играть в детское поле чудес";5;27;111;21
"поликлиника на октябрьском поле детская";5;39;145;21
"детский мир октябрьское поле";4;28;52;21
"пол ка детская 3";4;16;113;22
"мягкий детский пол пазл";4;23;468;21
"детский мягкий пол пазл";4;23;459;20
"игровой коврик на пол детский";5;29;133;21
"детская поликлиника на октябрьском поле";5;39;119;22
"пол ка 2 детская";4;16;126;20
"детская поликлиника октябрьское поле";4;36;124;18
"пол дэнс детский";3;16;77;19
"детский сад октябрьское поле";4;28;225;19
"детский поле чудес играть бесплатно";5;35;70;19
"поликлиника октябрьское поле детская";4;36;130;19
"коврик пазл детский на пол";5;26;443;18
"теплый детский пол пазлы";4;24;65;20
"поликлиника детская на октябрьском поле";5;39;131;19
"пол в детскую";3;13;22228;19
"детский пол дэнс";3;16;77;19
"теплый пол детский пазлы";4;24;65;20
"стоматология детская октябрьское поле";4;37;32;20
"купить мягкий пол в детскую";5;27;971;18
"коврик для детской на пол";5;25;1833;19
"теплый пол пазлы детский";4;24;65;20
"детский коврик пазл мягкий пол";5;30;94;18
"детские коврики на пол купить";5;29;338;16
"платье в пол детское купить";5;27;31;17
"2 детская пол ка";4;16;110;17
"морозко детский сад октябрьское поле";5;36;20;17
"детский теплый пол пазлы";4;24;65;17
"купить мягкий пол для детской";5;29;971;16
"пол ка детская";3;14;1717;17
"поле чудес детское играть бесплатно";5;35;71;17
"купить детские коврики на пол";5;29;349;17
"детский сад на вертолетном поле";5;31;43;17
"мягкие полы для детской";4;23;3307;17
"мягкий пол в детскую купить";5;27;964;17
"мягкий пол в детскую комнату";5;28;2214;16
"коврики детские на пол купить";5;29;349;17
"пол в детской";3;13;22228;17
"детское платье в пол";4;20;296;16
"мягкий пол детский мир";4;22;64;15
"мягкий пол для детской купить";5;29;964;15
"теплый пол детский пазлы купить";5;31;28;16
"покрытие в детскую на пол";5;25;514;15
"полы в детской комнате";4;22;3823;15
"мягкий детский пол коврик пазл";5;30;93;15
"поликлиника детская октябрьское поле";4;36;117;16
"пол в детскую комнату";4;21;3823;15
"детское поле чудес играть бесплатно";5;35;70;16
"мягкий пол для детской";4;22;3307;15
"платье детское в пол";4;20;284;16
"октябрьское поле детская поликлиника";4;36;117;16
"октябрьское поле детский сад";4;28;298;15
"частный детский сад октябрьское поле";5;36;59;16
"платье в пол детское";4;20;284;16
"детский мир мягкий пол";4;22;57;15
"детские ковры пазлы на пол";5;26;31;14
"детский мягкий пол коврик пазл";5;30;89;14
"пол 1 детская";3;13;479;14
"детский ковер футбольное поле";4;29;80;14
"1 пол детская";3;13;462;14
"поле чудес ответ детская игра";5;29;47;14
"купить детское платье в пол";5;27;28;15
"1 детская пол";3;13;462;14
"мягкие полы для детской комнаты";5;31;2214;14
"купить коврики на пол детские";5;29;308;14
"детское платье в пол купить";5;27;30;15
"купить платье в пол детское";5;27;28;15
"ковер детский футбольное поле";4;29;80;14
"купить в детскую мягкий пол";5;27;955;14
"ответ поле чудес детская игра";5;29;51;15
"детские ковры на пол пазлы";5;26;31;14
"детский пол пазлы купить";4;24;401;12
"гимнастика детская октябрьское поле";4;35;16;13
"палас на пол детский";4;20;82;13
"детский сад морозко октябрьское поле";5;36;14;13
"детская парикмахерская октябрьское поле";4;39;17;13
"покрытие для пола для детской";5;29;593;12
"покрытие детское на пол";4;23;618;13
"детский палас на пол";4;20;81;13
"пробковый пол в детской";4;23;156;13
"детский мягкий пол пазл отзывы";5;30;16;13
"поле чудес детский";3;18;698;13
"пол 3 детская";3;13;412;13
"пол для детской";3;15;22228;12
"детские игровые коврики на пол";5;30;143;13
"детский поле чудес";3;18;698;13
"детское в пол платье";4;20;239;12
"мягкий детский пол купить";4;25;989;11
"на пол в детскую ковер";5;22;1236;11
"39 детская пол ка";4;17;38;12
"ковер в детскую на пол";5;22;1229;11
"ромашковое поле детская песня слушать";5;37;21;12
"мягкий пол детский купить";4;25;989;11
"центр детский октябрьское поле";4;30;135;12
"детская песня ромашковое поле слушать";5;37;21;12
"мягкий пол детский коврик пазл";5;30;92;12
"детский теплый пол пазлы купить";5;31;21;12
"центр детский на октябрьском поле";5;33;136;12
"пол ка детская 2";4;16;120;12
"ковер на пол в детскую";5;22;1229;11
"детский сад русское поле";4;24;54;12
"пол для детской комнаты пазлы";5;29;198;12
"купить детский мягкий пол";4;25;989;11
"рисунок поле пшеницы детский";4;28;29;11
"средство для мытья пола детское";5;31;82;11
"пол 2 детская";3;13;564;11
"детский мир на октябрьском поле";5;31;47;11
"интерактивные полы для детского сада";5;36;180;11
"поле чудес играть бесплатно детский";5;35;44;11
"детское покрытие на пол";4;23;619;11
"2 детская пол";3;13;564;11
"2 пол детская";3;13;573;11
"играть детское поле чудес играть";5;32;97;11
"купить мягкий пол детский";4;25;943;11
"детское покрытие для пола";4;25;619;11
"детский рисунок футбольное поле";4;31;45;11
"детская пол 2";3;13;564;11
"купить мягкий детский пол";4;25;989;11
"детский рисунок поле пшеницы";4;28;29;11
"детское средство для мытья пола";5;31;86;10
"детская 4 пол";3;13;303;10
"покрытие для пола детское";4;25;618;10
"пробковый пол в детскую";4;23;156;10
"3 пол детская";3;13;391;10
"детская поликлиника лодейное поле";4;33;130;10
"полы в комнате детской";4;22;3512;10
"3 детская пол";3;13;391;10
"пол в детскую пазл";4;18;1319;10
"детская пол 3";3;13;391;10
"полы в детскую";3;14;22228;10
"пол пазл в детскую";4;18;1319;10
"лодейное поле поликлиника детская";4;33;133;10
"детский мягкий пол купить";4;25;991;10
"ромашковое поле песня слушать детская";5;37;17;11
"ромашковое поле детская песня";4;29;61;10
"футбольное поле детский рисунок";4;31;43;10
"футбольное поле рисунок детский";4;31;43;10
"купить детский палас на пол";5;27;36;10
"купить палас на пол детский";5;27;36;10
"детский палас на пол купить";5;27;36;10
"лодейное поле детский сад улыбка";5;32;31;10
"детская пол ка 39";4;17;29;10
"ромашковое поле песня детская слушать";5;37;20;10
"темный пол в детской фото";5;25;20;10
"детский ковер на пол интернет магазин";6;37;78;41
"детские коврики на пол интернет магазин";6;39;50;36
"детская для двух детей разного пола";6;35;218;33
"мягкий пол для детских комнат пазл";6;34;113;31
"пол в детской комнате что лучше";6;31;140;26
"детский игровой коврик на пол купить";6;36;31;26
"купить детский игровой коврик на пол";6;36;31;26
"покрытие в детскую комнату на пол";6;33;138;25
"покрытие на пол в детскую комнату";6;33;138;25
"покрытие для детской комнаты мягкий пол";6;39;34;24
"детские платья для девочек в пол";6;32;43;22
"детский ковер на пол с дорогами";6;31;37;22
"детские платья в пол для девочек";6;32;41;21
"детские коврики на пол для ползания";6;35;90;19
"ковер в детскую комнату на пол";6;30;113;18
"ковер на пол в детскую комнату";6;30;113;18
"ковер на пол в комнату детскую";6;30;113;18
"мягкий пол для детских комнат отзывы";6;36;21;17
"покрытие для пола в детской комнате";6;35;138;16
"пол в детскую комнату какой лучше";6;33;61;16
"пол для детской комнаты какой выбрать";6;37;31;16
"винни пух детский сад октябрьское поле";6;38;23;16
"купить мягкий пол пазл для детской";6;34;196;15
"коврики детские на пол для ползания";6;35;77;15
"какой пол выбрать для детской комнаты";6;37;30;15
"какой выбрать пол для детской комнаты";6;37;29;15
"детский сад винни пух октябрьское поле";6;38;21;15
"детские маты на пол для дома";6;28;21;15
"мягкое покрытие для пола в детской";6;34;61;14
"детские коврики для игры на полу";6;32;48;14
"детский коврик на пол для ползания";6;34;90;13
"танец ромашковое поле в детском саду";6;36;75;13
"детская песня во поле береза стояла";6;35;72;13
"какой лучше пол сделать в детской";6;33;40;13
"какой лучше сделать пол в детской";6;33;40;13
"какой пол сделать лучше в детской";6;33;40;13
"теплый пол в детском саду нормы";6;31;18;13
"лодейное поле детская поликлиника регистратура телефон";6;54;15;13
"детский санаторий русское поле московская область";6;49;20;12
"детская для двоих детей разного пола";6;36;286;11
"купить в детскую ковер на пол";6;29;247;11
"купить мягкий пол в детскую комнату";6;35;608;10
"мягкий пол в детскую комнату купить";6;35;608;10
"ковер на пол в детскую купить";6;29;324;10
"купить ковер на пол в детскую";6;29;324;10
"пол в детской комнате какой лучше";6;33;65;10
"какой лучше пол в детской комнате";6;33;66;10
"детские коврики на пол для мальчиков";6;36;18;10
"интерактивный пол для детского сада цена";6;40;11;10
"купить детский коврик на пол для ползания";7;41;53;46
"детские игровые коврики на пол для малышей";7;42;55;43
"мягкий пол в детскую комнату большие плитки";7;43;62;41
"детские комнаты для двоих детей разного пола";7;44;250;35
"детский сад радуга лодейное поле официальный сайт";7;49;34;33
"детский сад солнышко лодейное поле официальный сайт";7;51;30;30
"видео танец ромашковое поле в детском саду";7;42;44;23
"танец ромашковое поле видео в детском саду";7;42;44;23
"танец в детском саду ромашковое поле видео";7;42;45;23
"детская комната для двух детей разного пола";7;43;132;22
"пол в детской что постелить на пол";7;34;88;21
"ромашковое поле танец в детском саду видео";7;42;44;21
"мягкий пол для детской комнаты коврик пазл";7;42;34;21
"ковер детский футбольное поле sintelon play 1700х1200";7;53;21;21
"детские пазлы на пол для малышей купить";7;39;21;20
"мягкий пол для детских комнат пазл купить";7;41;41;19
"что постелить в детской комнате на пол";7;38;36;19
"танец ромашковое поле в детском саду видео";7;42;41;18
"детские ковры на пол фото и цена";7;32;21;18
"детский ковер на пол интернет магазин дешево";7;44;18;18
"дизайн детской для двух детей разных полов";7;42;25;17
"детский иммунологический центр в москве октябрьское поле";7;56;22;17
"улыбка детский сад лодейное поле официальный сайт";7;49;17;17
"что постелить на пол в детской комнате";7;38;26;15
"официальный сайт детский сад улыбка лодейное поле";7;49;15;14
"детский сад катюша лодейное поле официальный сайт";7;49;15;14
"мягкий пол для детских купить в москве";7;38;137;13
"детская игра 7 букв игра поле чудес";7;35;26;13
"детская игра 7 букв поле чудес игра";7;35;26;13
"ответ детская игра поле чудес 7 букв";7;36;20;13
"какой лучше сделать пол в детской комнате";7;41;18;13
"какой пол лучше сделать в детской комнате";7;41;18;13
"детский сад улыбка лодейное поле официальный сайт";7;49;14;13
"купить мягкий пол пазл для детских комнат";7;41;35;12
"мягкий пол пазл для детских комнат купить";7;41;35;12
"мягкий пол для детских комнат 60x60 см";7;38;15;12
"детский танец видео во поле береза стояла";7;41;59;11
"во поле береза стояла детский танец видео";7;41;53;11
"во поле береза стояла танец детский видео";7;41;53;11
"детский танец во поле береза стояла видео";7;41;53;11
"мягкий пол для детских комнат купить екатеринбург";7;49;22;11
"детские ковры на пол для мальчиков фото";7;39;21;11
"какой лучше пол сделать в детской комнате";7;41;19;11
"детский ковер на пол купить в москве";7;36;17;11
"что лучше постелить на пол в детской";7;36;28;10
"детская игра 7 букв ответ поле чудес";7;36;15;10
"детская игра 7 букв поле чудес ответ";7;36;15;10
"детская игра поле чудес ответ 7 букв";7;36;15;10
"детский коврик пазлы на пол большие размеры";7;43;10;10
"мягкий пол для детских комнат купить в спб";8;42;119;102
"мягкий пол для детских комнат купить в москве";8;45;103;57
"интерьер детской комнаты для двух детей разного пола";8;52;77;48
"детские комнаты для двоих детей разного пола фото";8;49;109;38
"коврик пазл для детей мягкий пол детский мир";8;44;20;18
"игра не оставайся на полу в детском саду";8;40;21;18
"детская для троих детей разного возраста и пола";8;47;16;13
"моу бендерский детский сад 32 танец ромашковое поле";8;51;12;12
"танец ромашковое поле моу бендерский детский сад 32";8;51;12;12
"купить мягкий пол пазл для детских комнат купить";8;48;46;11
"детские комнаты для двоих детей разного пола купить";8;51;15;11
"самозапись к врачу красное село детская пол 28";8;46;14;11
"клипы детские далеко ускакала в поле молодая лошадь";8;51;11;11
"детские клипы далеко ускакала в поле молодая лошадь";8;51;11;11
"детская для двух детей разного пола и возраста";8;46;33;10
"во поле береза стояла танец в детском саду видео";9;48;40;40
"танец во поле береза стояла в детском саду видео";9;48;40;40
"танец во поле береза стояла видео в детском саду";9;48;40;40
"танец в детском саду во поле береза стояла видео";9;48;40;40
