"Ключевое слово";"Слов";"Символов";"Частотность Весь мир";"""!Частотность !Весь !мир"""
"детский коврик пазлы на пол в леруа мерлен цена";9;47;29;29
"детские комнаты для двоих детей разного пола дизайн фото";9;56;27;25
"мягкий пол для детских комнат купить недорого в москве";9;54;26;16
"интерьер детской комнаты для двух детей разного пола фото";9;57;17;16
"записаться на прием к врачу сургут детская пол 2";9;48;16;16
"мебель для детской комнаты для двоих детей разного пола";9;55;26;13
"мягкий пол для детских комнат купить в москве недорого";9;54;20;12
"танец а ромашковое поле зацвело в детском саду видео";9;52;14;12
"как обустроить детскую комнату для двоих детей разного пола";9;59;28;11
"дизайн детские комнаты для двоих детей разного пола фото";9;56;14;10
"мебель для детской комнаты для двоих детей разного пола фото";10;60;13;10
