"Ключевое слово";"Слов";"Символов";"Частотность Весь мир";"""!Частотность !Весь !мир"""
"коврик пазл";2;11;28724;1781
"детский коврик пазл купить";4;26;1330;190
"коврики пазлы для детей";4;23;8186;276
"коврик пазл детский";3;19;3931;339
"коврики для детей пазлы";4;23;8186;276
"коврик пазл рф";3;14;426;292
"пазлы коврики";2;13;28723;262
"коврик пазл для детей";4;21;8186;1441
"коврик детский пазл";3;19;3931;339
"коврик пазл купить";3;18;7016;436
"пазлы коврики для детей";4;23;8123;286
"пазл коврик для детей";4;21;8123;1461
"купить коврик пазл";3;18;7016;436
"коврики пазлы";2;13;28723;262
"детский коврик пазл";3;19;3931;339
"пазл коврик";2;11;28724;1781
"коврик пазл детский купить";4;26;1330;190
"коврик для сборки пазлов";4;24;437;96
"мягкий коврик пазл";3;18;2661;105
"фикс прайс пазл коврик";4;22;346;107
"коврик пазл мягкий";3;18;2661;105
"фикс прайс коврик пазл";4;22;346;107
"коврик пазл алфавит";3;19;453;98
"коврики детские пазлы";3;21;3931;147
"пазл коврик фикс прайс";4;22;346;107
"коврики пазлы детские";3;21;3931;147
"мягкий пазл коврик";3;18;2661;105
"купить детский коврик пазл";4;26;1234;179
"детские коврики пазлы";3;21;3931;147
"коврик пазл фикс прайс";4;22;321;100
"детские коврики пазлы большие";4;29;393;134
"коврик для пазлов";3;17;28079;181
"коврик пазл купить екатеринбург";4;31;238;93
"коврик массажный орто пазл";4;26;486;68
"пазлы коврик";2;12;28773;72
"пазл коврик массажный";3;21;1176;75
"коврик пазлы";2;12;28723;72
"отзывы коврик пазл";3;18;571;75
"коврик пазл детский мир";4;23;187;69
"коврик для ползания пазл";4;24;1176;90
"пазл коврик отзывы";3;18;571;75
"коврик пазл ортопедический";3;26;1333;87
"коврик пазл отзывы";3;18;571;75
"коврик пазл для ползания";4;24;1176;90
"коврик пазл с ворсом";4;20;260;88
"детский мир коврик пазл";4;23;187;69
"ортопедический коврик пазл";3;26;1333;87
"коврик пазл екатеринбург купить";4;31;238;93
"массажный коврик орто пазл";4;26;479;67
"коврики пазлы ортопедические";3;28;1333;55
"коврики пазлы купить";3;20;7016;56
"ортопедические пазлы коврики";3;28;1362;59
"коврик для пазлов купить";4;24;7306;55
"купить пазлы коврики";3;20;7016;56
"ортопедические коврики пазлы";3;28;1333;55
"коврик пазл массажный";3;21;1006;64
"коврик пазл funkids";3;19;280;58
"коврик пазл играем вместе";4;25;425;62
"купить коврики пазлы";3;20;7016;56
"массажный коврик пазл";3;21;1006;64
"играем вместе коврик пазл";4;25;425;62
"купить коврик для пазлов";4;24;6990;55
"ортопедический пазл коврик";3;26;1313;61
"орто пазл коврик массажный";4;26;479;67
"большие напольные пазлы коврики";4;31;113;55
"купить большой коврик пазл";4;26;440;45
"напольный пазл коврик";3;21;682;45
"большой коврик пазл купить";4;26;466;48
"напольный коврик пазл";3;21;682;45
"коврик пазл спб купить";4;22;653;47
"купить коврик пазл большой";4;26;440;45
"коврик развивающий пазл";3;23;435;49
"коврик пазл купить спб";4;22;653;47
"коврик пазл купить большой";4;26;466;48
"коврик пазл мягкий пол";4;22;1284;45
"развивающий коврик пазл";3;23;435;49
"напольные пазлы коврики большие";4;31;98;49
"коврик пазл напольный";3;21;682;45
"коврик пазл большой купить";4;26;466;48
"купить коврик пазл спб";4;22;634;49
"детские пазлы коврики купить";4;28;1330;44
"коврик пазл дорога";3;18;213;42
"мягкие пазлы коврики";3;20;2661;42
"животные пазл коврик";3;20;198;44
"мягкие коврики пазлы";3;20;2661;42
"игровой коврик пазл";3;19;410;43
"купить детские коврики пазлы";4;28;1234;42
"напольные пазлы коврики";3;23;682;44
"коврик пазл игровой";3;19;410;43
"коврики пазлы напольные";3;23;682;44
"коврики пазлы мягкие";3;20;2661;42
"напольные коврики пазлы";3;23;682;44
"коврики напольные пазлы";3;23;682;44
"мягкий пол коврик пазл";4;22;1253;42
"коврик пазл животные";3;20;198;44
"детские коврики пазлы купить";4;28;1330;44
"детский ортопедический коврик пазл";4;34;164;41
"коврики пазлы больших размеров";4;30;163;36
"большой коврик пазл";3;19;1191;36
"мягкий коврик пазл купить";4;25;718;37
"большой пазл коврик";3;19;1191;36
"коврик пазл большой";3;19;1191;36
"пазл коврик цифры";3;17;211;36
"купить коврик пазлы мягкие";4;26;771;38
"коврики пазлы рф";3;16;393;37
"купить мягкий коврик пазл";4;25;718;37
"пазл коврик большой";3;19;1191;36
"коврик детский ортопедический пазл";4;34;164;41
"коврик мягкий пазл купить";4;25;743;37
"коврик пазл цифры";3;17;211;36
"мягкий пазл коврик купить";4;25;718;37
"детский коврик пазл ортопедический";4;34;164;41
"коврик пазл ортопедический массажный";4;36;113;36
"коврик пазл оптом";3;17;231;32
"коврик пазл русский алфавит";4;27;136;33
"массажный ортопедический коврик пазл";4;36;108;34
"коврик для собирания пазлов";4;27;52;33
"коврик пазл город";3;17;343;33
"цена коврик пазл";3;16;370;32
"орто пазл коврик";3;16;803;34
"коврик орто пазл";3;16;863;33
"орто коврик пазл";3;16;788;34
"русский алфавит коврик пазл";4;27;137;33
"пазлы коврики большие";3;21;1146;34
"коврик пазл орто";3;16;788;34
"коврики пазл орто";3;17;1006;32
"ортопедический массажный коврик пазл";4;36;108;34
"коврик массажный ортопедический пазл";4;36;113;36
"коврики пазлы напольные детские";4;31;215;32
"коврик пазлы купить";3;19;7016;24
"пазл коврик цена";3;16;376;27
"икеа коврик пазл";3;16;600;28
"коврик пазл цена";3;16;376;27
"коврик пазл mambobaby";3;21;151;28
"коврик цифры пазл";3;17;199;26
"коврик пазл город пеппы";4;23;120;31
"коврик пазл икеа";3;16;590;28
"пазл коврики";2;12;28774;28
"mambobaby коврик пазл";3;21;151;28
"funkids коврик пазл";3;19;189;31
"оптом пазл коврик";3;17;241;30
"пазл коврик машинки";3;19;92;27
"коврики пазл";2;12;28724;28
"коврики пазлы большие";3;21;1191;31
"пазлы коврик купить";3;19;7016;24
"коврик пазл elc";3;15;46;22
"коврик пазл машинки";3;19;85;22
"пазл коврик союзмультфильм";3;26;107;23
"заказать пазл коврик";3;20;85;22
"союзмультфильм коврик пазл";3;26;103;23
"пазл коврик elc";3;15;46;22
"орто пазл коврики";3;17;813;24
"коврик пазл союзмультфильм";3;26;107;23
"коврики орто пазл";3;17;803;24
"алиэкспресс пазл коврик";3;23;87;22
"купить коврик пазлы";3;19;7016;24
"орто коврики пазл";3;17;813;24
"elc коврик пазл";3;15;46;22
"коврик пазл пеппа";3;17;334;23
"купить пазлы коврик";3;19;7016;24
"азбука коврик пазл";3;18;112;21
"коврик детский пазлы";3;20;3931;17
"пазлы детский коврик";3;20;3931;17
"коврик пазл ру";3;14;36;19
"пазлы коврик детский";3;20;3931;17
"пазл коврик ру";3;14;32;18
"детский пазлы коврик";3;20;3931;17
"коврик пазл алиэкспресс";3;23;88;20
"фото коврик пазл";3;16;151;18
"пазл коврик сафари";3;18;42;20
"коврик пазлы детский";3;20;3931;17
"коврик пазл фото";3;16;163;20
"алиэкспресс коврик пазл";3;23;88;20
"детский коврик пазлы";3;20;3931;17
"коврик elc пазл";3;15;38;19
"пазл азбука коврик";3;18;107;21
"спб коврик пазл";3;15;834;17
"сафари коврик пазл";3;18;38;16
"коврик пазл спб";3;15;835;16
"коврик пазл азбука";3;18;105;17
"пазл коврик буквы";3;17;166;16
"заказать коврик пазл";3;20;74;17
"коврик буквы пазл";3;17;166;16
"пазлы резиновые коврики";3;23;149;17
"коврик пазл заказать";3;20;74;17
"азбука пазл коврик";3;18;105;17
"пазл коврик спб";3;15;835;16
"коврики пазлы оптом";3;19;231;17
"пазл коврик азбука";3;18;105;17
"коврик пазл буквы";3;17;166;16
"коврик азбука пазл";3;18;105;17
"пазлы коврики оптом";3;19;231;17
"пазл коврик киров";3;17;33;16
"коврики пазлы резиновые";3;23;141;14
"екатеринбург коврик пазл";3;24;242;14
"elc пазл коврик";3;15;41;15
"пазл коврик новосибирск";3;23;161;14
"пазл коврик екатеринбург";3;24;300;14
"коврики резиновые пазлы";3;23;141;14
"коврики массажные пазлы";3;23;1006;15
"флексика коврик пазл";3;20;39;15
"однотонный коврик пазл";3;22;51;15
"коврик пазл екатеринбург";3;24;300;14
"массажные пазлы коврики";3;23;1006;15
"коврики пазлы массажные";3;23;1006;15
"резиновые коврики пазлы";3;23;141;14
"коврик пазл однотонный";3;22;51;15
"массажные коврики пазлы";3;23;1006;15
"кораблик пазл коврик";3;20;56;14
"коврик пазл 50х50";3;17;30;12
"фиксики коврик пазл";3;19;45;12
"коврик пазл африка";3;18;20;13
"коврик пазл фиксики";3;19;44;12
"коврики для пазлов";3;18;28079;12
"коврик пазл сафари";3;18;31;12
"пазл затейники коврик";3;21;74;13
"пазл коврик африка";3;18;20;13
"коврик пазл флексика";3;20;30;13
"коврики пазлы полы";3;18;1863;12
"музыкальный коврик пазл";3;23;17;14
"коврик пазл 60х60";3;17;57;13
"пазл коврик фиксики";3;19;44;12
"коврик пазл чебоксары";3;21;29;13
"коврик двухсторонний пазл";3;25;53;14
"коврик пазл дороги";3;18;213;11
"коврик пазл акушерство";3;22;22;11
"двухсторонний пазл коврик";3;25;46;11
"затейники коврик пазл";3;21;61;11
"двухсторонний коврик пазл";3;25;46;11
"коврик пазл зоопарк";3;19;60;11
"пазл коврик океан";3;17;43;11
"лучший коврик пазл";3;18;69;11
"пазл коврик затейники";3;21;61;11
"коврик пазл уфа";3;15;63;11
"пазл коврик зоопарк";3;19;60;11
"челябинск коврик пазл";3;21;124;11
"коврик мозаика пазл";3;19;68;11
"коврик пазл океан";3;17;43;11
"коврик пазл затейники";3;21;61;11
"челябинск коврики пазлы";3;23;166;11
"акушерство коврик пазл";3;22;22;11
"коврик для пазла";3;16;28034;10
"развивающие пазлы коврики";3;25;435;10
"развивающие коврики пазлы";3;25;435;10
"коврики развивающие пазлы";3;25;435;10
"пазл коврик дешево";3;18;96;10
"жанетт коврик пазл";3;18;51;10
"коврик пазл жанетт";3;18;49;10
"коврик океан пазл";3;17;39;10
"юлмарт коврик пазл";3;18;33;10
"skip hop коврик пазл";4;20;94;31
"коврик для детей пазлы";4;22;8186;30
"коврик пазлы для детей";4;22;8186;30
"детские мягкие коврики пазлы";4;28;270;30
"детские мягкие пазлы коврики";4;28;270;30
"ортопедические детские коврики пазлы";4;36;160;30
"купить мягкие пазлы коврик";4;26;718;29
"мягкие детские коврики пазлы";4;28;256;29
"детские коврики пазлы ортопедические";4;36;164;29
"детские ортопедические коврики пазлы";4;36;164;29
"леруа мерлен коврик пазл";4;24;156;28
"коврик пазл леруа мерлен";4;24;154;28
"коврик пазл skip hop";4;20;87;28
"рич фэмили коврик пазл";4;22;64;28
"детский мягкий коврик пазл";4;26;270;26
"детский мягкий пазл коврик";4;26;270;26
"детский коврик пазл напольный";4;29;115;26
"дочки сыночки коврик пазл";4;25;70;26
"коврик пазл дочки сыночки";4;25;70;26
"пазл коврик купить киев";4;23;39;26
"детский коврик пазл большой";4;27;393;25
"мягкий детский коврик пазл";4;26;256;25
"коврик пазл напольный купить";4;28;157;25
"купить коврик пазл напольный";4;28;151;25
"купить напольный коврик пазл";4;28;151;25
"напольный коврик пазл купить";4;28;151;25
"напольный пазл коврик купить";4;28;151;25
"пазл коврик город пеппы";4;23;89;25
"заказать детский коврик пазл";4;28;44;25
"заказать коврик пазл детский";4;28;44;25
"напольный детский коврик пазл";4;29;106;24
"коврик напольный детский пазл";4;29;106;24
"мягкие пазлы коврик купить";4;26;638;23
"детские коврики пазлы напольные";4;31;115;23
"коврики напольные пазлы детские";4;31;115;23
"напольные детские пазлы коврики";4;31;115;23
"напольные коврики пазлы детские";4;31;115;23
"коврик пазл купить недорого";4;27;89;23
"купить коврик пазл недорого";4;27;90;23
"коврик пазл винни пух";4;21;44;23
"детский коврик пазл классики";4;28;41;23
"коврик пазл детский классики";4;28;41;23
"массажные коврики орто пазл";4;27;498;22
"коврики пазлы большие купить";4;28;466;22
"коврик пазл свинка пеппа";4;24;92;22
"детский игровой коврик пазл";4;27;90;22
"пазл коврик винни пух";4;21;42;22
"интернет магазин коврик пазл";4;28;405;21
"коврик пазл интернет магазин";4;28;405;21
"детские напольные коврики пазлы";4;31;142;21
"детские напольные пазлы коврики";4;31;142;21
"коврик пазл купить новосибирск";4;30;91;21
"коврик пазл город купить";4;24;73;21
"купить коврик пазл город";4;24;68;21
"пазл коврик свинка пеппа";4;24;76;21
"коврик пазл киев купить";4;23;50;21
"коврик пазл купить киев";4;23;50;21
"пазл коврик купить украина";4;26;44;21
"купить коврик пазл оптом";4;24;42;21
"коврик пазл мягкий купить";4;25;638;20
"купить мягкий пазл коврик";4;25;638;20
"детский коврик пазл мягкий";4;26;275;20
"коврик детский мягкий пазл";4;26;275;20
"мягкий коврик детский пазл";4;26;275;20
"мягкий детский пазл коврик";4;26;220;20
"купить коврик пазл киев";4;23;48;20
"отзывы коврик пазл рф";4;21;48;20
"детский напольный коврик пазл";4;29;142;19
"коврик детский напольный пазл";4;29;142;19
"коврик пазл детский напольный";4;29;142;19
"мягкие большие пазлы коврики";4;28;123;19
"детский коврик пазл развивающий";4;31;111;19
"детский коврик развивающий пазл";4;31;111;19
"большие мягкие коврики пазлы";4;28;114;19
"свинка пеппа коврик пазл";4;24;57;19
"коврик пазл купить украина";4;26;43;19
"купить коврик пазл украина";4;26;43;19
"украина коврик пазл купить";4;26;43;19
"коврик пазл производство россия";4;31;23;19
"напольные коврики пазлы купить";4;30;163;18
"напольные детские коврики пазлы";4;31;129;18
"детский коврик пазл резиновый";4;29;70;18
"детский резиновый коврик пазл";4;29;70;18
"коврик резиновый детский пазл";4;29;70;18
"коврик пазл рф отзывы";4;21;45;18
"пазлы коврики большие купить";4;28;429;17
"орто коврик пазл купить";4;23;163;17
"орто пазл коврик купить";4;23;138;17
"купить коврик орто пазл";4;23;138;17
"коврик пазл орто купить";4;23;138;17
"купить коврик пазл 60х60";4;24;26;17
"купить большие пазлы коврики";4;28;440;16
"коврик орто пазл купить";4;23;134;16
"большой коврик пазл напольный";4;29;113;16
"коврик пазл напольный большой";4;29;113;16
"коврик пазл детский развивающий";4;31;98;16
"коврик пазл своими руками";4;25;98;16
"детский коврик пазл цена";4;24;91;16
"коврик пазл детский цена";4;24;91;16
"купить напольные пазлы коврики";4;30;77;16
"игровой детский коврик пазл";4;27;73;16
"коврик детский игровой пазл";4;27;73;16
"коврик игровой детский пазл";4;27;73;16
"коврик пазл funkids купить";4;26;61;16
"funkids коврик пазл купить";4;26;61;16
"дочки сыночки пазл коврик";4;25;53;16
"коврик для сбора пазлов";4;23;51;16
"рич фэмили пазл коврик";4;22;31;16
"коврики пазлы пермь купить";4;26;23;16
"детский коврик из пазлов";4;24;4243;15
"коврик детский из пазлов";4;24;4243;15
"коврик из пазлов детский";4;24;4243;15
"коврики для ползания пазлы";4;26;1176;15
"коврики пазлы для ползания";4;26;1176;15
"где купить коврик пазл";4;22;197;15
"коврик пазл где купить";4;22;197;15
"где купить пазл коврик";4;22;166;15
"пазл коврик где купить";4;22;166;15
"напольные пазлы коврики купить";4;30;151;15
"купить коврик пазл алфавит";4;26;134;15
"коврик алфавит пазл купить";4;26;113;15
"купить коврик пазл новосибирск";4;30;97;15
"коврик пазл новосибирск купить";4;30;97;15
"детский коврик пазл екатеринбург";4;32;71;15
"коврик пазл детский екатеринбург";4;32;71;15
"резиновый детский коврик пазл";4;29;63;15
"коврик пазл челябинск купить";4;28;45;15
"детский коврик резиновый пазл";4;29;40;15
"резиновый коврик детский пазл";4;29;40;15
"коврик пазл рич фэмили";4;22;30;15
"пазл коврик на пол";4;18;1918;14
"коврик на пол пазл";4;18;1963;14
"коврик пазл на пол";4;18;1963;14
"купить мягкие коврики пазлы";4;27;602;14
"пазлы коврик фикс прайс";4;23;348;14
"коврик пазлы фикс прайс";4;23;346;14
"фикс прайс пазлы коврик";4;23;346;14
"фикс прайс коврик пазлы";4;23;348;14
"купить коврик пазл минск";4;24;243;14
"пазл коврик купить минск";4;24;243;14
"коврик пазл купить минск";4;24;245;14
"коврик пазл минск купить";4;24;245;14
"коврик пазл алфавит купить";4;26;131;14
"мягкие коврики пазлы большие";4;28;123;14
"мягкие пазлы коврики большие";4;28;123;14
"детские пазлы развивающие коврики";4;33;111;14
"детский развивающий коврик пазл";4;31;106;14
"коврик пазл купить оптом";4;24;42;14
"купить оптом коврик пазл";4;24;41;14
"детский коврик пазлы купить";4;27;1330;13
"купить детский коврик пазлы";4;27;1234;13
"купить ортопедические коврики пазлы";4;35;294;13
"ортопедические коврики пазлы купить";4;35;294;13
"коврик пазл дети магазин";4;24;242;13
"коврик пазл магазин дети";4;24;242;13
"детские игровые пазлы коврики";4;29;73;13
"коврик пазл детский игровой";4;27;64;13
"сима ленд коврик пазл";4;21;52;13
"коврик пазл fisher price";4;24;40;13
"fisher price коврик пазл";4;24;39;13
"коврик пазл скип хоп";4;20;24;13
"коврики пазлы купить пермь";4;26;19;13
"магазин дети коврик пазл";4;24;229;12
"купить коврики пазл орто";4;24;163;12
"детские коврики пазлы развивающие";4;33;106;12
"детские коврики развивающие пазлы";4;33;106;12
"детские развивающие коврики пазлы";4;33;106;12
"коврики детские развивающие пазлы";4;33;106;12
"игровой коврик пазл купить";4;26;101;12
"развивающий детский коврик пазл";4;31;95;12
"большой напольный коврик пазл";4;29;67;12
"большой напольный пазл коврик";4;29;67;12
"коврик пазл теплый пол";4;22;60;12
"коврик пазл дешево купить";4;25;46;12
"коврик пазл счастливый город";4;28;43;12
"купить коврик пазл цифры";4;24;43;12
"коврик пазл сима ленд";4;21;42;12
"купить коврик цифры пазл";4;24;41;12
"коврик пазл цифры купить";4;24;40;12
"детский коврик пазл заказать";4;28;28;12
"заказать детский пазл коврик";4;28;28;12
"коврик пазл mambobaby ферма";4;27;15;12
"коврик для детской пазл";4;23;4063;11
"купить коврик пазлы детский";4;27;1244;11
"коврик пазлы детский купить";4;27;1244;11
"пазл коврик в спб";4;17;743;11
"купить мягкие пазлы коврики";4;27;718;11
"мягкие коврики пазлы купить";4;27;718;11
"мягкие пазлы коврики купить";4;27;718;11
