"Ключевое слово";"Слов";"Символов";"Частотность Весь мир";"""!Частотность !Весь !мир"""
"коврики пазлы ортопедические купить";4;35;311;11
"ортопедические пазлы коврики купить";4;35;311;11
"коврик пазл большого размера";4;28;167;11
"пазлы коврики для малышей";4;25;156;11
"напольный коврик пазл большой";4;29;98;11
"коврики орто пазл отзывы";4;24;65;11
"коврик пазл с бортиками";4;23;57;11
"коврик пазл дорога купить";4;25;44;11
"mambobaby коврик пазл ферма";4;27;13;11
"пазл коврик в детскую";4;21;3640;10
"коврик пазл в спб";4;17;863;10
"коврики для сборки пазлов";4;25;437;10
"купить коврик пазл ортопедический";4;33;309;10
"детские резиновые коврики пазлы";4;31;70;10
"коврик пазл развивающий купить";4;30;59;10
"теплый пол коврик пазл";4;22;57;10
"купить коврик пазл дорога";4;25;43;10
"коврик пазл купить дешево";4;25;40;10
"коврик пазл купить казань";4;25;38;10
"купить коврик пазл экополимеры";4;30;24;10
"коврик пазл экополимеры купить";4;30;24;10
"экополимеры коврик пазл купить";4;30;24;10
"скип хоп коврик пазл";4;20;21;10
"коврик пазл однотонный купить";4;29;16;10
"коврик пазл мегаполис купить";4;28;11;10
"коврик пазл для детей купить";5;28;2214;337
"купить коврик пазл для детей";5;28;2214;337
"пазл коврик для детей купить";5;28;2172;336
"мягкий коврик пазл для детей";5;28;1633;249
"детский коврик пазлы на пол";5;27;525;212
"коврик пазл для детей мягкий";5;28;1428;181
"ортопедический коврик для детей пазл";5;36;787;160
"ортопедический коврик пазл для детей";5;36;787;160
"коврик пазл для детей ортопедический";5;36;763;160
"коврик пазл ортопедический для детей";5;36;763;160
"купить в спб коврик пазл";5;24;589;156
"коврик пазл для детей икеа";5;26;543;137
"коврик пазл купить в спб";5;24;658;128
"купить коврик пазл в спб";5;24;658;128
"ортопедические коврики для детей пазлы";5;38;787;122
"ортопедические коврики пазлы для детей";5;38;787;122
"коврик для детей массажный пазл";5;31;335;99
"большой коврик пазл для детей";5;29;387;89
"коврик пазл большой для детей";5;29;383;85
"коврик пазл для детей большой";5;29;383;85
"коврики пазлы для детей купить";5;30;2214;84
"купить коврики пазлы для детей";5;30;2214;84
"пазлы коврики для детей купить";5;30;2172;81
"напольные пазлы для детей коврик";5;32;284;81
"детский коврик пазл для ползания";5;32;409;78
"мягкие коврики пазлы для детей";5;30;1633;76
"коврик для сборки пазлов купить";5;31;136;72
"купить коврик для сборки пазлов";5;31;136;72
"коврик для детей пазлы купить";5;29;2214;71
"коврик пазлы для детей купить";5;29;2214;71
"купить коврик для детей пазлы";5;29;2214;71
"купить коврик пазлы для детей";5;29;2214;71
"коврик пазл для детей челябинск";5;31;83;64
"модульный массажный коврик орто пазл";5;36;184;63
"купить коврик пазлы мягкие большие";5;34;82;62
"детские напольные коврики пазлы купить";5;38;70;58
"детские напольные пазлы коврики купить";5;38;70;58
"напольный коврик пазл для детей";5;31;284;56
"напольный пазл коврик для детей";5;31;282;56
"коврик пазл напольный для детей";5;31;287;56
"коврик массажный модульный орто пазл";5;36;180;56
"коврик пазл купить в минске";5;27;244;55
"купить коврик пазл в минске";5;27;244;55
"коврик для сборки пазлов 3000";5;29;113;55
"коврик массажный для детей пазл";5;31;169;48
"коврик массажный пазл для детей";5;31;169;48
"коврик пазл для детей массажный";5;31;169;48
"коврик пазл массажный для детей";5;31;169;48
"массажный коврик для детей пазл";5;31;169;48
"массажный коврик пазл для детей";5;31;169;48
"напольные коврики пазлы для детей";5;33;284;46
"напольные пазлы коврики для детей";5;33;282;45
"коврик пазл купить в москве";5;27;616;44
"купить коврик пазл в москве";5;27;616;44
"развивающий коврик для детей пазл";5;33;146;44
"напольный коврик для детей пазл";5;31;231;43
"коврик пазл купить в екатеринбурге";5;34;236;41
"купить коврик пазл в екатеринбурге";5;34;236;41
"пазл коврик купить в екатеринбурге";5;34;245;41
"детские коврики пазлы для ползания";5;34;409;40
"детские пазлы коврики для ползания";5;34;409;40
"коврик пазл для детей отзывы";5;28;111;40
"коврик детский пазл купить спб";5;30;114;40
"развивающий коврик пазл для детей";5;33;143;39
"детский коврик пазл большой купить";5;34;148;38
"купить детский коврик пазл большой";5;34;148;38
"купить детские коврики пазлы спб";5;32;137;38
"коврик детский пазл на пол";5;26;540;36
"коврик пазл на пол детский";5;26;540;36
"развивающий пазл коврик для детей";5;33;121;36
"маша и медведь коврик пазл";5;26;156;36
"коврик пазл в туле купить";5;25;45;36
"коврик пазл купить в туле";5;25;45;36
"детский коврик пазл на пол";5;26;525;35
"детский пазл на пол коврик";5;26;525;35
"мягкий детский коврик пазл купить";5;33;87;34
"детский мягкий коврик пазл купить";5;33;85;34
"купить детский мягкий коврик пазл";5;33;86;34
"купить пазлы коврик для детей";5;29;2123;32
"детский коврик на пол пазл";5;26;546;31
"коврик пазл с ворсом купить";5;27;54;30
"детский пазл коврик на пол";5;26;492;29
"игровой коврик для детей пазл";5;29;54;29
"игровой коврик пазл для детей";5;29;54;29
"коврик пазл игровой для детей";5;29;54;29
"коврик детский напольный развивающий пазл";5;41;30;29
"детские коврики на пол пазлы";5;28;525;27
"детские коврики пазлы на пол";5;28;525;27
"коврики детские на пол пазлы";5;28;540;27
"коврик пазл маша и медведь";5;26;115;27
"коврик для детей из пазлов";5;26;8440;24
"коврик из пазлов для детей";5;26;8440;24
"коврик пазл для ребенка купить";5;30;2214;24
"купить коврик пазл для ребенка";5;30;2214;24
"коврик для ползания пазл купить";5;31;376;24
"коврик пазл для ползания купить";5;31;376;24
"купить коврик пазл для ползания";5;31;376;24
"детский коврик пазл детский мир";5;31;186;24
"где купить детский пазл коврик";5;30;56;24
"детский коврик пазл где купить";5;30;56;24
"детский ортопедический коврик пазл купить";5;41;44;24
"ортопедический детский коврик пазл купить";5;41;44;24
"купить детский ортопедический коврик пазл";5;41;44;23
"детский коврик пазл ортопедический купить";5;41;61;22
"детские коврики пазлы большие купить";5;36;148;21
"купить детские коврики пазлы большие";5;36;148;21
"напольный детский развивающий коврик пазл";5;41;33;21
"коврик пазл большой размер спб";5;30;24;21
"пазлы коврики для ползания малышей";5;34;25;20
"коврики для ползания малышей пазлы";5;34;25;20
"коврики пазлы для ползания малышей";5;34;25;20
"купить в новосибирске коврик пазл";5;33;119;19
"пазл коврик пазл алфавит купить";5;31;95;19
"коврик детский ортопедический пазл купить";5;41;61;19
"купить напольные детские коврики пазлы";5;38;32;19
"коврик для ползания ребенка пазл";5;32;437;18
"коврик пазл для ползания ребенка";5;32;437;18
"коврик пазл детский на пол";5;26;443;18
"детский коврик для ползания пазлы";5;33;409;18
"коврик пазл из фикс прайса";5;26;346;18
"пазл коврик из фикс прайса";5;26;348;18
"детский коврик пазл мягкий пол";5;30;94;18
"сборный коврик пазл для детей";5;29;19;18
"купить коврик для ребенка пазл";5;30;2022;17
"коврики пазлы для ползания купить";5;33;376;17
"пазлы коврики для ползания купить";5;33;383;17
"коврик орто пазл массажный купить";5;33;60;17
"коврик пазл купить в киеве";5;26;41;17
"купить в киеве коврик пазл";5;26;41;17
"купить коврик пазл в киеве";5;26;41;17
"mambobaby коврик пазл животный мир";5;34;20;17
"детские коврики для ползания пазл";5;33;409;16
"коврик пазл для детей спб";5;25;277;16
"игровой коврик пазл для малыша";5;30;23;16
"купить детский коврик пазл алфавит";5;34;19;16
"мягкий детский пол коврик пазл";5;30;93;15
"орто пазл коврик массажный купить";5;33;61;15
"купить мягкий детский коврик пазл";5;33;56;15
"купить детский коврик пазл минск";5;32;48;15
"детский коврик пазл купить минск";5;32;46;15
"где купить детский коврик пазл";5;30;42;15
"коврик пазл купить в уфе";5;24;36;15
"купить коврик пазл в уфе";5;24;36;15
"коврик пазл счастливый город спб";5;32;15;15
"коврик пазл купить в новосибирске";5;33;92;14
"купить коврик пазл в новосибирске";5;33;92;14
"детский мягкий пол коврик пазл";5;30;89;14
"купить детский коврик пазл москва";5;33;83;14
"коврик детский пазл купить москва";5;33;83;14
"коврик пазл детский купить москва";5;33;75;14
"купить коврик пазл детский москва";5;33;75;14
"купить коврик пазл в ростове";5;28;43;14
"детский коврик пазл алфавит купить";5;34;17;14
"коврик для пазлов купить спб";5;28;658;13
"купить коврик для пазлов спб";5;28;658;13
"коврик детский пазл детский мир";5;31;165;13
"детский коврик пазл купить спб";5;30;133;13
"коврик для детей пазл цена";5;26;116;13
"коврик пазл для детей цена";5;26;116;13
"коврик для пазлов своими руками";5;31;120;13
"отзывы коврик пазл фикс прайс";5;29;45;13
"пазл коврик фикс прайс отзывы";5;29;45;13
"пазл коврик купить в ростове";5;28;41;13
"коврик пазл резиновый для детей";5;31;37;13
"коврик пазл skip hop playspot";5;29;36;13
"резиновый коврик пазл для детей";5;31;37;13
"резиновый коврик для детей пазл";5;31;32;13
"купить детский игровой коврик пазл";5;34;29;13
"развивающий коврик пазл русский алфавит";5;39;18;13
"коврик пазл для детей юлмарт";5;28;16;13
"коврик пазл для детей напольный";5;31;126;12
"коврик напольный пазл для детей";5;31;120;12
"коврик пазл 60 на 60";5;20;108;12
"мягкий пол детский коврик пазл";5;30;92;12
"коврик для детей пазл фото";5;26;64;12
"массажный коврик орто пазл купить";5;33;59;12
"фото коврик пазл для детей";5;26;49;12
"коврик пазл фикс прайс отзывы";5;29;46;12
"детский игровой коврик пазл купить";5;34;46;12
"коврик пазл купить в ярославле";5;30;46;12
"игровой пазл коврик для детей";5;29;45;12
"коврик пазл для детей казань";5;28;27;12
"игровой коврик для малыша пазл";5;30;20;12
"коврик пазл mambobaby карта мира";5;32;12;12
"коврики пазлы для детей большие";5;31;383;11
"большие коврики пазлы для детей";5;31;387;11
"большие пазлы коврики для детей";5;31;387;11
"коврик 60 на 60 пазл";5;20;103;11
"коврик пазл купить в краснодаре";5;31;47;11
"купить в краснодаре коврик пазл";5;31;47;11
"купить коврик пазл в краснодаре";5;31;47;11
"коврик пазл детский русский алфавит";5;35;29;11
"коврик пазл русский алфавит детский";5;35;29;11
"детский коврик пазл русский алфавит";5;35;26;11
"коврик пазл развивающий русский алфавит";5;39;14;11
"купить коврик пазл счастливый город";5;35;11;11
"коврик для ползания пазл ребенка";5;32;442;10
"коврик мягкий пол пазл купить";5;29;174;10
"коврик пазл мягкий пол купить";5;29;174;10
"купить коврик пазл мягкий пол";5;29;174;10
"мягкий пол коврик пазл купить";5;29;176;10
"купить в екатеринбурге коврик пазл";5;34;160;10
"коврик пазл 2 см толщина";5;24;45;10
"коврик пазл толщина 2 см";5;24;45;10
"где можно купить коврик пазл";5;28;42;10
"резиновые коврики для детей пазлы";5;33;37;10
"резиновые коврики пазлы для детей";5;33;37;10
"коврик пазл счастливый город купить";5;35;20;10
"коврик для сбора пазлов купить";5;30;19;10
"купить коврик для сбора пазлов";5;30;19;10
"юлмарт коврик пазл для детей";5;28;10;10
"коврик пазл для детей мягкий пол";6;32;986;305
"коврики для детей для ползания пазлы";6;36;460;204
"коврики пазлы для детей для ползания";6;36;460;204
"купить мягкие коврики пазлы для детей";6;37;343;83
"мягкие коврики пазлы для детей купить";6;37;343;83
"коврик пазл для детей ортопедический купить";6;43;181;64
"купить ортопедический коврик пазл для детей";6;43;169;63
"коврик пазл ортопедический для детей купить";6;43;184;63
"ортопедический коврик для детей пазл купить";6;43;162;60
"ортопедический коврик пазл для детей купить";6;43;162;60
"большой коврик пазл для детей купить";6;36;116;59
"коврик пазл для детей большой купить";6;36;116;59
"детский коврик пазл для ползания купить";6;39;190;55
"купить детский коврик пазл для ползания";6;39;190;55
"коврик пазл для детей мягкий купить";6;35;356;49
"купить большой коврик пазл для детей";6;36;89;45
"коврик пазл большой для детей купить";6;36;86;40
"коврики пазлы для детей интернет магазин";6;40;245;39
"коврик для пазлов до 3000 деталей";6;33;87;39
"массажный коврик пазл для детей купить";6;38;55;38
"мягкий коврик пазл для детей купить";6;35;343;36
"коврик из пазлов для детей большой";6;34;389;32
"купить мягкий коврик пазл для детей";6;35;316;30
"детские коврики пазлы для ползания купить";6;41;190;30
"купить детские коврики пазлы для ползания";6;41;190;30
"коврик пазл для ребенка для ползания";6;36;460;28
"коврик для детей для ползания пазл";6;34;460;26
"коврик пазл для детей для ползания";6;34;460;26
"коврик пазл для ползания ребенка купить";6;39;126;25
"купить коврик пазл для ползания ребенка";6;39;126;25
"большой детский коврик пазл для ползания";6;40;64;25
"напольный коврик пазл для детей большой";6;39;32;25
"большой коврик для детей из пазлов";6;34;270;24
"коврик пазл для детей с ворсом";6;30;34;24
"коврик пазл для детей купить спб";6;32;164;23
"купить коврик пазл для детей спб";6;32;164;23
"коврик пазл купить в нижнем новгороде";6;37;113;23
"купить коврик пазл в нижнем новгороде";6;37;113;23
"пазл детский коврик для ползания большой";6;40;64;23
"детские коврики пазлы большие купить москва";6;43;24;23
"детский коврик пазл купить в спб";6;32;138;22
"купить детский коврик пазл в спб";6;32;138;22
"детский коврик пазл в леруа мерлен";6;34;73;21
"коврик пазл в леруа мерлен детский";6;34;73;21
"детские коврики для ползания пазлы купить";6;41;175;18
"купить детские коврики для ползания пазлы";6;41;171;18
"коврик пазл напольный для детей купить";6;38;41;18
"напольный коврик пазл для детей купить";6;38;41;18
"мягкие коврики пазлы для детей большие";6;38;35;18
"коврик для сборки пазлов своими руками";6;38;21;18
"коврик пазл кто живет в лесу";6;28;21;16
"детский массажный коврик орто пазл отзывы";6;41;17;15
"купить массажный ортопедический коврик пазл микс";6;48;16;15
"коврик для детей на пол пазл";6;28;1045;14
"коврик пазл для детей на пол";6;28;1045;14
"коврик пазл на пол для детей";6;28;1045;14
"пазл коврик на пол для детей";6;28;1033;14
"коврик пазл из фикс прайса отзывы";6;33;46;14
"детский коврик для ползания большой пазл";6;40;42;14
"детский коврик пазл для ползания большой";6;40;42;14
"коврик пазл алфавит 36 элементов купить";6;39;19;14
"коврик для ребенка для ползания пазл";6;36;442;13
"детские коврики пазлы купить в москве";6;37;120;13
"купить коврик пазл детский в спб";6;32;114;13
"коврик пазл для детей большой размер";6;36;46;13
"как выбрать коврик пазл для детей";6;33;19;13
"коврик пазл рф отзывы о сайте";6;29;15;13
"коврики пазлы в спб для детей";6;29;258;12
"коврики пазлы для детей в спб";6;29;258;12
"детский коврик для ползания пазлы купить";6;40;190;12
"большие детские коврики для ползания пазлы";6;42;61;12
"детские коврики пазлы большие для ползания";6;42;61;12
"детские коврики пазлы купить в минске";6;37;53;12
"купить коврик для детей из пазлов";6;33;2199;11
"купить мягкий коврик пазл для ребенка";6;37;303;11
"коврик для пазлов собери и сверни";6;33;36;11
"купить напольный коврик пазл для детей";6;38;28;11
"коврик пазл с ворсом для детей";6;30;28;11
"коврик из пазлов для детей купить";6;33;2197;10
"купить коврик из пазлов для детей";6;33;2197;10
"пазл коврик детский купить в спб";6;32;114;10
"купить в минске детский коврик пазл";6;35;51;10
"большие мягкие пазлы коврики для детей";6;38;32;10
"коврик пазл для детей леруа мерлен";6;34;27;10
"коврик пазл для детей купить самара";6;35;19;10
"коврик пазл для детей мягкий пол икеа";7;37;383;345
"ортопедический коврик для детей пазл от плоскостопия";7;52;303;242
"коврик пазл для детей купить в москве";7;37;320;110
"купить коврик пазл для детей в москве";7;37;320;110
"коврик пазл для детей купить в минске";7;37;64;28
"купить коврик пазл для детей в минске";7;37;64;28
"детские коврики пазлы в детскую комнату купить";7;46;38;27
"коврики для детей для ползания пазлы купить";7;43;126;26
"коврики пазлы для детей для ползания купить";7;43;126;26
"коврик пазл для детей купить в спб";7;34;160;21
"коврик пазл для детей мягкий пол купить";7;39;137;21
"мягкий пол для детской комнаты коврик пазл";7;42;34;21
"коврик для сборки пазлов купить в москве";7;40;33;20
"коврик пазл играем вместе маша и медведь";7;40;33;20
"коврик пазл маша и медведь играем вместе";7;40;33;20
"коврик с пазлами большой купить в спб";7;37;50;19
"детский коврик пазл большой купить в екатеринбурге";7;50;24;19
"детский коврик пазл русский алфавит 25x25 см";7;44;18;18
"коврик для сборки пазлов купить в минске";7;40;16;16
"коврик пазл для ползания до года купить";7;39;16;16
"купить коврик для сборки пазлов в минске";7;40;16;16
"ravensburger коврик для пазлов до 3000 деталей";7;46;18;15
