"Ключевое слово";"Слов";"Символов";"Частотность Весь мир";"""!Частотность !Весь !мир"""
"коврик пазл для детей купить в екатеринбурге";7;44;33;13
"купить коврик пазл для детей в екатеринбурге";7;44;33;13
"коврик детский для массажа стоп пазлами купить";7;46;15;13
"коврики пазлы для детей купить в спб";7;36;160;12
"коврик пазл для детей купить в витебске";7;39;12;12
"купить коврик пазл для детей в новосибирске";7;43;34;11
"купить в новосибирске коврик пазл для детей";7;43;34;11
"купить большой коврик для ползания большой пазл";7;47;34;10
"детские коврики для ползания пазл в москве";7;42;19;10
"купить коврик пазл для детей в челябинске";7;41;17;10
"детские мягкие пазлы коврики купить в барнауле";7;46;10;10
"детский коврик пазлы на пол большие размеры";7;43;10;10
"купить коврик пазл для детей в интернет магазине";8;48;148;70
"коврики пазлы для детей интернет магазин в спб";8;46;45;45
"коврик пазл для детей мягкий пол икеа цена";8;42;30;29
"ортопедический коврик для детей пазл от плоскостопия купить";8;59;35;24
"коврик для сборки пазлов коврик для сборки пазлов";8;49;266;22
"купить детский коврик пазл для ползания в спб";8;45;25;20
"коврик пазл для детей мягкий пол детский мир";8;44;20;18
"купить коврик пазл для детей от 6 месяцев";8;41;32;16
"купить в спб детский коврик пазл для ползания";8;45;24;16
"коврик пазл для детей мягкий пол фикс прайс";8;43;16;15
"мягкий коврик пазл для детей купить в минске";8;44;16;14
"коврик пазл для детей купить в нижнем новгороде";8;47;58;10
"купить коврик пазл для детей в нижнем новгороде";8;47;38;10
"коврик пазл для детей купить в спб большой";8;42;10;10
"детский коврик пазлы на пол в леруа мерлен цена";9;47;29;29
"коврики для детей для ползания пазлы купить в москве";9;52;36;21
"коврики пазлы для детей для ползания купить в москве";9;52;36;21
"коврики пазлы для детей для ползания купить в спб";9;49;21;19
"коврик пазл для детей мягкий пол купить в спб";9;45;18;15
"развивающий коврик пазл для детей от 0 до 3 лет";10;47;32;27
"коврик массажный модульный орто пазл 8 модулей микс покрытий и цветов 1";12;71;13;11
