"Ключевое слово";"Слов";"Символов";"Частотность Весь мир";"""!Частотность !Весь !мир"""
"детская комната для двух девочек 15 м кв";8;40;61;25
"интерьер детской комнаты для девочки 7 лет фото";8;47;39;25
"детские комнаты для девочек дизайн фото 10 лет";8;46;118;24
"натяжные потолки для детской комнаты для девочек фото";8;53;208;23
"ремонт детской комнаты для девочки и мальчика фото";8;50;86;23
"дизайн детской комнаты 13 кв м для девочки";8;42;69;23
"дизайн детской комнаты для девочки 13 кв м";8;42;69;23
"дизайн комнаты для подростка девочки 10 кв м";8;44;54;23
"дизайн для детской комнаты для девочки 10 лет";8;45;277;22
"дизайн для детской комнаты для девочки 3 лет";8;44;125;22
"какие обои выбрать в детскую комнату для девочки";8;48;88;22
"шкафы угловые в детскую комнату для девочек фото";8;48;53;22
"угловые шкафы в детскую комнату фото для девочек";8;48;53;22
"купить обои для детской комнаты для девочек фото";8;48;27;22
"обои для детской комнаты для девочек фото купить";8;48;27;22
"обои в детскую комнату фото для девочек фото";8;44;854;21
"как сделать детскую комнату для девочки и мальчика";8;50;112;21
"как сделать детскую комнату для мальчика и девочки";8;50;112;21
"шкафы купе в детскую комнату для девочки фото";8;45;66;21
"угловые шкафы в детскую комнату для девочек фото";8;48;32;21
"шкафы в детскую комнату для девочек фото угловые";8;48;32;21
"разделение комнаты на 2 зоны для двух девочек";8;45;21;21
"детские комнаты для мальчика и для девочки фото";8;47;1429;20
"игры для девочек бесплатно моя новая комната игры";8;49;147;20
"дизайн детской комнаты для девочки 16 кв м";8;42;124;20
"фото детской комнаты для девочки в хрущевке фото";8;48;115;20
"детская комната для девочки 7 лет фото дизайн";8;45;68;20
"фото дизайн детская комната для девочки 7 лет";8;45;69;20
"дизайн детская комната для девочки 7 лет фото";8;45;66;20
"комната в стиле хай тек для девочки подростка";8;45;57;20
"комната для девочки подростка в хай тек стиле";8;45;57;20
"дизайн детской комнаты в хрущевке фото для девочки";8;50;49;20
"комната для девочки подростка 13 лет дизайн фото";8;48;29;20
"игры для девочек перестановки в комнатах и домах";8;48;31;20
"рисунки комната моей мечты для девочек 12 лет";8;45;27;20
"дизайн комнаты для девочек подростков в современном стиле";8;57;1209;19
"фото детской комнаты для двух девочек фото дизайн";8;49;322;19
"как сделать комнату детскую для девочки и мальчика";8;50;147;19
"детская комната для девочки фото дизайн 7 лет";8;45;68;19
"комната мечты для девочки подростка рисунок в карандаше";8;55;36;19
"детские комнаты для мальчиков и для девочек фото";8;48;1327;18
"купить мебель для детской комнаты для двух девочек";8;50;43;18
"мебель для детской комнаты для двух девочек купить";8;50;43;18
"дизайн комнаты 10 кв м для девочки подростка";8;44;47;18
"дизайн комнаты 10 кв м для подростка девочки";8;44;47;18
"дизайн комнаты для девочки подростка 10 кв м";8;44;47;18
"мебель для девочки 12 лет в маленькой комнате";8;45;20;18
"квартирный вопрос детская комната для девочки и мальчика";8;56;21;18
"квартирный вопрос детская комната для мальчика и девочки";8;56;21;18
"комната для девочки 6 лет дизайн и планировка";8;45;18;18
"чем отличается комната девочки подростка от спальни ответы";8;58;18;18
"дизайн для детской комнаты для двух девочек фото";8;48;358;17
"фото дизайн детской комнаты для двух девочек фото";8;49;323;17
"обои для детскую комнату для мальчика и девочки";8;47;225;17
"как украсить комнату на годик девочке своими руками";8;51;100;17
"детская комната для девочки 7 лет дизайн фото";8;45;49;17
"комната для подростка девочки 17 лет дизайн фото";8;48;24;17
"игры для девочек бесплатно дизайн дома и комнаты";8;48;21;17
"шторы в детскую комнату для девочки подростка фото";8;50;21;17
"шторы в детскую комнату для подростка девочки фото";8;50;21;17
"фото детские комнаты для мальчика и девочки вместе";8;50;162;16
"фото детской комнаты для девочки 5 лет фото";8;43;109;16
"как украсить комнату на выписку девочки из роддома";8;50;100;16
"как украсить комнату на выписку из роддома девочки";8;50;90;16
"фото дизайн детской комнаты для девочки 7 лет";8;45;66;16
"зона сна и отдыха в комнате девочки подростка";8;45;34;16
"как украсить комнату на 1 год девочке фото";8;42;32;16
"оформление комнаты на день рождения девочки 1 год";8;49;23;16
"детские комнаты для девочек и для мальчиков фото";8;48;1429;15
"детские комнаты фото для мальчика и девочки фото";8;48;1300;15
"детские комнаты для девочки и мальчика вместе фото";8;50;157;15
"детские комнаты для мальчика и девочки вместе фото";8;50;157;15
"дизайн комнаты для девочки подростка в современном фото";8;55;72;15
"дизайн детской комнаты в хрущевке для девочки фото";8;50;45;15
"дизайн детской комнаты для девочки в хрущевке фото";8;50;45;15
"как оформить детскую комнату для девочки своими руками";8;54;40;15
"комната для девочки подростка 17 лет дизайн фото";8;48;23;15
"сочетание цветов в интерьере детской комнаты для девочки";8;56;20;15
"украшение комнаты на 1 годик девочке своими руками";8;50;20;15
"школа ремонта детская комната для девочки и мальчика";8;52;19;15
"школа ремонта детская комната для мальчика и девочки";8;52;19;15
"дизайн детской маленькой комнаты для двух девочек фото";8;54;17;15
"дизайн маленькой детской комнаты для двух девочек фото";8;54;17;15
"дизайн комнаты 12 кв м для девочки подростка";8;44;246;14
"дизайн комнаты для девочки подростка 12 кв м";8;44;246;14
"дизайн комнаты для подростка девочки 12 кв м";8;44;246;14
"декор для комнаты для девочки подростка своими руками";8;53;216;14
"детская комната для двоих детей девочка и мальчик";8;49;176;14
"детская комната для девочки и мальчика вместе фото";8;50;157;14
"детская комната для мальчика и девочки вместе фото";8;50;157;14
"игры для девочек переделки моя новая комната 4";8;46;152;14
"идеи для детской комнаты для девочек своими руками";8;50;52;14
"идеи для детской комнаты своими руками для девочек";8;50;52;14
"дизайн детской комнаты для девочки 7 лет фото";8;45;49;14
"девочка исчезла на 24 года в своей комнате";8;42;23;14
"угловой шкаф купе в детскую комнату для девочки";8;47;23;14
"игры для девочек бесплатно дизайнер дома и комнат";8;49;19;14
"игры для девочек дизайнер дома и комнат бесплатно";8;49;19;14
"комната для подростка девочки 13 лет дизайн фото";8;48;15;14
"украсить комнату девочки на день рождения своими руками";8;55;359;13
"обои в детскую комнату для девочки и мальчика";8;45;259;13
"обои в детскую комнату для мальчика и девочки";8;45;259;13
"детская комната для двоих детей мальчик и девочка";8;49;181;13
"оформление детской комнаты для мальчика и для девочки";8;53;130;13
"детская комната для двух девочек фото и варианты";8;48;141;13
"дизайн детской комнаты 15 кв м для девочки";8;42;103;13
"дизайн детской комнаты для девочки 15 кв м";8;42;103;13
"фото дизайн маленькой детской комнаты для девочек фото";8;54;85;13
"дизайн детской комнаты для девочки 14 м кв";8;42;86;13
"дизайн детской комнаты для девочки для узкой комнаты";8;52;84;13
"дизайн комнаты для девочки и мальчика вместе фото";8;49;79;13
"дизайн комнаты для мальчика и девочки вместе фото";8;49;79;13
"обои в детскую комнату для девочек 10 лет";8;41;78;13
"шторы в детскую комнату для девочки и мальчика";8;46;56;13
"шторы в детскую комнату для мальчика и девочки";8;46;56;13
"ремонт комнаты для девочки подростка в маленькой комнате";8;56;39;13
"как сделать комнату для мальчика и девочки вместе";8;49;32;13
"детская комната для двоих девочек фото и варианты";8;49;29;13
"интерьер комнаты для девочки подростка в современном стиле";8;58;28;13
"комната для мальчика и девочки вместе интерьер фото";8;51;28;13
"дизайн спальни для девочки подростка в маленькой комнате";8;56;22;13
"ремонт детской комнаты для девочки 10 кв м";8;42;17;13
"дизайн комнаты для девочки подростка и маленькой девочки";8;56;191;12
"игры для девочек переделки моя новая комната 3";8;46;150;12
"фото комната для девочки 5 лет дизайн фото";8;42;88;12
"дизайн для маленькой детской комнаты фото для девочек";8;53;86;12
"фото детская комната для девочки 5 лет дизайн";8;45;66;12
"как сделать комнату для девочки и мальчика вместе";8;49;45;12
"дизайн детской комнаты для мальчика и девочки обои";8;50;22;12
"люстра облако в детскую комнату для девочки купить";8;50;13;12
"детская комната для девочки фото дизайн в квартире";8;50;737;11
"комната 12 кв м для девочки 12 лет";8;34;348;11
"комната для девочки 12 лет 12 кв м";8;34;348;11
"игры для девочек бесплатно переделки комнат для девочек";8;55;262;11
"фото комната для девочки 10 лет дизайн фото";8;43;224;11
"комната для девочки 10 лет 10 кв м";8;34;194;11
"фото детской комнаты для девочек в хрущевке фото";8;48;136;11
"интерьер детской комнаты для девочки 12 м кв";8;44;128;11
"фото детские комнаты для девочки и мальчика вместе";8;50;119;11
"комната для подростков для девочки и мальчика фото";8;50;111;11
"фото детской комнаты в хрущевке фото для девочек";8;48;115;11
"мебель для детской комнаты для девочки 3 лет";8;44;55;11
"короткие шторы в детскую комнату фото для девочек";8;49;26;11
"интерьер детской комнаты 10 кв м для девочки";8;44;22;11
"какой цвет лучше для детской комнаты для девочки";8;48;21;11
"интерьер комнаты для мальчика и девочки разных возрастов";8;56;18;11
"комната для девочки подростка дизайн мебели и ремонт";8;52;16;11
"детская комната для девочки фото дизайн 10 метров";8;49;15;11
"цветовое решение детской комнаты для мальчика и девочки";8;55;12;11
"как украсить свою комнату для девочек своими руками";8;51;1175;10
"как украсить свою комнату своими руками для девочек";8;51;1175;10
"детская комната для девочки 12 кв м дизайн";8;42;731;10
"детская комната для девочки в квартире дизайн фото";8;50;636;10
"украсить комнату на день рождения девочки своими руками";8;55;379;10
"фото детские комнаты для 2 девочек фото дизайн";8;46;164;10
"детские комнаты для девочек фото дизайн для 2";8;45;162;10
"дизайн для детской комнаты для девочки 8 лет";8;44;118;10
"цвета для детской комнаты для мальчика и девочки";8;48;59;10
"детские комнаты для девочек 5 лет фото дизайн";8;45;57;10
"как оформить комнату для девочки подростка своими руками";8;56;27;10
"как в одной комнате разместить девочку и мальчика";8;49;26;10
"как в одной комнате разместить мальчика и девочку";8;49;26;10
"как разместить девочку и мальчика в одной комнате";8;49;26;10
"идеи для комнаты для девочки своими руками фото";8;47;25;10
"обои для детской комнаты для девочек каталог фото";8;49;20;10
"обои для детской комнаты каталог фото для девочек";8;49;20;10
"комната девочки подростка планировка и дизайн фото сверху";8;57;15;10
"комната для девочки подростка и маленького мальчика совместно";8;61;13;10
"мебель для подростковой комнаты для девочки купить москва";8;57;11;10
"фотообои для детской комнаты для девочек фото 3d";8;48;10;10
"детская комната для девочки фото дизайн в квартире реальные";9;59;650;227
"дизайн детской комнаты для девочки 12 кв м фото";9;47;544;194
"шторы в детскую комнату для девочки фото новинки 2017";9;53;136;123
"детская комната для двух девочек фото и варианты планировки";9;59;133;82
"презентация на тему комната девочки подростка 6 класс технология";9;64;120;78
"фото детской комнаты для двух девочек разного возраста фото";9;59;138;70
"дизайн детской комнаты для девочки 9 кв м фото";9;46;126;64
"ремонт в детской комнате для мальчика и девочки вместе";9;54;82;60
"дизайн комнаты для двух девочек подростков в современном стиле";9;62;67;57
"комната для девочки подростка 12 16 лет идеи дизайна";9;52;65;56
"как украсить свою комнату своими руками для девочек подростков";9;62;326;55
"как разделить комнату на две зоны для девочек подростков";9;56;235;53
"мебель детская комната для двоих детей мальчик и девочка";9;56;66;46
"интерьер для детской комнаты для двух девочек разного возраста";9;62;83;42
"интерьер детской комнаты для двух девочек разного возраста фото";9;63;44;42
"комната для девочки и мальчика одна на двоих дизайн";9;51;86;41
"обои для детской комнаты для мальчика и для девочки";9;51;264;40
"сочинение на тему описание комнаты 6 класс для девочек";9;54;188;40
"купить обои в детскую комнату для девочек в спб";9;47;46;38
"обои в детскую комнату для девочек купить в спб";9;47;46;38
"дизайн детской комнаты для девочки 10 кв м фото";9;47;135;37
"интерьер комнаты для подростка девочки 14 лет небольшая комната";9;63;44;37
"интерьер комнаты для подростка девочки 14 лет модный тренд";9;58;38;36
"обои в детскую комнату для мальчика и для девочки";9;49;225;35
"игры для девочек строить дома и комнаты с людьми";9;48;73;35
"игры строить дома и комнаты с людьми для девочек";9;48;73;35
"мебель для детских комнат для двух девочек в воронеже";9;53;35;35
"игры для девочек переделки домов и комнат и квартир";9;51;194;34
"игры для девочек переделки квартир и домов и комнат";9;51;194;34
"игры для девочек переделки комнат и домов и квартир";9;51;194;34
"как украсить комнату на 1 годик девочке своими руками";9;53;58;33
"бесплатные игры для девочек переделки домов комнат и квартир";9;60;183;32
"детская комната 10 кв м дизайн фото для девочки";9;47;135;30
"детская комната для девочки дизайн фото 10 кв м";9;47;135;30
"мебель для девочки подростка 15 лет в маленькую комнату";9;55;30;28
"комната для мальчика и девочки вместе разного возраста фото";9;59;35;27
"декор для комнаты своими руками для девочки своими руками";9;57;539;26
"как сделать комнату и для мальчика и для девочки";9;48;283;26
"обои в детскую комнату для девочек 12 лет фото";9;46;54;25
"обои в детскую комнату для девочек фото 12 лет";9;46;54;25
"декор комнаты своими руками из подручных материалов для девочек";9;63;42;24
"интерьер детской комнаты для мальчика и девочки вместе мальчика";9;63;355;23
"мебель в детскую комнату для девочек купить в спб";9;49;40;23
"ковер в детскую комнату для девочек купить в москве";9;51;45;23
"сочинение на тему интерьер моей комнаты 6 класс девочки";9;55;25;23
"сочинение на тему моя комната 6 класс для девочек";9;49;356;22
"сочинение на тему моя комната для девочек 6 класс";9;49;356;22
"дизайн детской комнаты для двух девочек разного возраста фото";9;61;47;22
"дизайн детской комнаты для двух девочек фото разного возраста";9;61;47;22
"играть в игры для девочек переделки домов и комнат";9;50;30;22
"играть в игры для девочек переделки комнат и домов";9;50;30;22
"играть в игры переделки домов и комнат для девочек";9;50;30;22
"играть в игры переделки комнат и домов для девочек";9;50;30;22
"как украсить комнату на день выписки из роддома девочки";9;55;24;22
"детская для девочки комната 12 кв м интерьер фото";9;49;75;21
"детская комната 12 кв м для девочки интерьер фото";9;49;73;21
"комната одна на двоих для мальчика и девочки фото";9;49;50;21
"комната для двух девочек разного возраста фото 17 метров";9;56;22;21
"дизайн комнаты для девочки подростка в современном стиле фото";9;61;48;20
"фото дизайн комнаты для девочки подростка в современном стиле";9;61;48;20
"детские комнаты для девочки и мальчика вместе зелено розовая";9;60;20;20
"интерьер для детской комнаты для мальчика и девочки вместе";9;58;330;19
"обои для детской комнаты для девочки и мальчика фото";9;52;66;19
"обои для детской комнаты для мальчика и девочки фото";9;52;66;19
"обои для детской комнаты фото для мальчика и девочки";9;52;66;19
"детская комната 12 кв м интерьер фото для девочки";9;49;49;19
"детская комната для девочки 12 кв м интерьер фото";9;49;49;19
"обои в детскую комнату для девочек 10 лет фото";9;46;42;19
"обои в детскую комнату фото для девочек 10 лет";9;46;42;19
"дизайн детской комнаты для девочки фото 11 кв м";9;47;27;19
"дизайн детской для девочки и мальчика в одной комнате";9;53;1348;18
"дизайн детской для мальчика и девочки в одной комнате";9;53;1348;18
"дизайн детской комнаты для девочки и мальчика вместе фото";9;57;59;18
