"Ключевое слово";"Слов";"Символов";"Частотность Весь мир";"""!Частотность !Весь !мир"""
"комната девочки";2;15;142462;225
"дизайн комнаты подростка девочки";4;32;6751;228
"комнаты для подростков девочек";4;30;35827;353
"комнаты для девочек";3;19;144109;1072
"комнаты для девочек подростков";4;30;35827;353
"комната для девочек";3;19;144111;629
"комната детская для девочек";4;27;60307;258
"комната для девочки";3;19;144115;1627
"дизайн комнаты для девочки";4;26;25735;637
"комната подростка девочки";3;25;33369;1440
"комната для двух девочек";4;24;7523;361
"комната для девочки подростка";4;29;32601;2078
"детские комнаты для девочек";4;27;60307;1535
"детская комната для девочек";4;27;60307;258
"комната девочки подростка";3;25;33369;1440
"комната для подростка девочки";4;29;32601;2078
"дизайн комнаты девочки подростка";4;32;6751;228
"фото комнаты для девочек";4;24;22996;116
"картинки комнаты для девочек";4;28;1880;132
"комнаты для девочек дизайн";4;26;25735;140
"подростковые комнаты для девочек";4;32;3195;126
"красивые комнаты для девочек";4;28;2427;140
"комната для девочек подростков";4;30;35827;123
"интерьер для комнаты девочки";4;28;8504;204
"дизайн комнаты для девочек";4;26;25735;140
"интерьер комнаты девочки подростка";4;34;2474;165
"комнаты для девочек картинки";4;28;1880;132
"интерьер комнаты для девочки";4;28;8504;204
"интерьер комнаты подростка девочки";4;34;2474;165
"комната для подростков девочек";4;30;35827;123
"подростковая комната для девочки";4;32;3197;150
"детская комната для девочки";4;27;60307;2981
"комната подростка девочки рисунок";4;33;709;113
"комнаты для девочек игры";4;24;5369;74
"фото комната для девочки";4;24;22996;81
"комната для новорожденной девочки";4;33;558;89
"игры комнаты для девочек";4;24;5369;74
"мебель для комнаты девочки";4;26;8677;85
"комнаты игры для девочек";4;24;5369;74
"комната девочки подростка рисунок";4;33;596;98
"комната для девочки новорожденной";4;33;558;89
"комната девочки подростка презентация";4;37;712;93
"комната для девочки фото";4;24;23077;83
"комнаты для девочек фото";4;24;23077;109
"рисунок комната девочки подростка";4;33;568;95
"игры для девочек комнаты";4;24;5369;74
"презентация комната девочки подростка";4;37;677;91
"комната для 2 девочек";4;21;3230;111
"эскиз комнаты подростка девочки";4;31;178;64
"комната маленькая для девочки";4;29;3370;51
"эскиз комнаты девочки подростка";4;31;119;55
"фото комнаты подростка девочки";4;30;3892;58
"детская комната девочки заказ";4;29;159;54
"игры комната для девочек";4;24;5369;57
"маленькая комната для девочки";4;29;3380;51
"комната розовая для девочки";4;27;770;60
"фото комнаты девочки подростка";4;30;3892;58
"комната для девочки маленькая";4;29;3145;59
"игры для девочек комната";4;24;5369;57
"комната мечты для девочки";4;25;1183;61
"комната для девочки розовая";4;27;770;60
"обои для комнаты девочки";4;24;6889;52
"розовая комната для девочки";4;27;774;59
"комнаты девочки подростка фото";4;30;3969;63
"комната для девочки мечты";4;25;989;51
"комнаты для подростка девочки";4;29;32601;44
"шторы в комнату девочки";4;23;3088;47
"комната подростка девочки дизайн";4;32;6751;48
"проект комната девочки подростка";4;32;952;47
"дизайн комната девочки подростка";4;32;6751;48
"комнаты для девочки подростка";4;29;32601;44
"комната фото девочки подростка";4;30;3681;50
"дизайн комната подростка девочки";4;32;6751;48
"фото комнат для девочек";4;23;22996;48
"комната девочки подростка дизайн";4;32;6751;48
"комната подростка фото девочки";4;30;3681;50
"комната девочки подростка проект";4;32;973;50
"красивая комната для девочки";4;28;2430;46
"комната подростка дизайн девочки";4;32;6751;48
"лайфхаки для комнаты девочки";4;28;119;51
"комната для девочек фото";4;24;23077;44
"картинки комната для девочек";4;28;1880;37
"картинки комната подростка девочки";4;34;442;38
"декор комнаты для девочки";4;25;1215;39
"комната подростка девочки картинки";4;34;442;38
"комнаты для 2 девочек";4;21;3230;38
"комната для девочек картинки";4;28;1880;37
"фото комната для девочек";4;24;22996;41
"декор для комнаты девочки";4;25;1215;39
"картинки комнат для девочек";4;27;1880;40
"картинки комната девочки подростка";4;34;442;38
"уборка в комнате девочки";4;24;535;43
"комната для двоих девочек";4;25;1890;41
"комната девочки подростка картинки";4;34;442;38
"комната подростка девочки проект";4;32;852;40
"как украсить комнату девочки";4;28;3498;43
"картинки для девочек комната";4;28;1880;37
"идеи комнаты для девочки";4;24;2005;34
"планировка комнаты девочки подростка";4;36;532;35
"комната мечты подростка девочки";4;31;464;36
"детская комната девочки";3;23;58221;34
"комната для девочки дизайн";4;26;25735;35
"идеи для комнаты девочки";4;24;2005;34
"икеа комната для девочки";4;24;703;36
"дизайн комната для девочки";4;26;25735;35
"комната икеа для девочки";4;24;703;36
"планировка комнаты подростка девочки";4;36;532;35
"комната для девочек двоих";4;25;1816;36
"комната для девочки икеа";4;24;703;36
"комната детская девочки";3;23;58221;34
"комната мечты девочки подростка";4;31;464;36
"комната девочка";2;15;138956;36
"дизайн комнат для девочек";4;25;25735;33
"комнаты для девочек интерьер";4;28;8504;29
"комнаты детские для девочки";4;27;60307;29
"комната для девочки голубая";4;27;338;31
"детские комнаты для девочки";4;27;60307;29
"картинки комнаты подростка девочки";4;34;442;30
"комната дизайн для девочки";4;26;24433;29
"комната девочки подростка фото";4;30;3969;33
"голубая комната для девочки";4;27;338;31
"рисунок комнаты девочки подростка";4;33;568;32
"картинки комнаты девочки подростка";4;34;442;30
"фото комнаты для девочки";4;24;22996;33
"комната подростка девочки фото";4;30;3969;33
"детская девочки комната";3;23;56852;29
"комната школьника для девочки";4;29;454;31
"для девочек дизайн комнат";4;25;25735;33
"интерьер комнаты для девочек";4;28;8504;29
"комнаты для двух девочек";4;24;7522;22
"комнаты подростка девочки";3;25;33369;23
"для девочек переделки комнаты";4;29;1898;26
"комнаты девочки подростка";3;25;33369;23
"комнаты крутые для девочек";4;26;219;24
"оформление комнаты для девочки";4;30;1716;23
"комнаты для девочки";3;19;144113;27
"комната подростка девочки раскраска";4;35;67;25
"фото комната подростка девочки";4;30;3892;26
"крутые комнаты для девочек";4;26;219;24
"обои в комнату девочки";4;22;6889;28
"раскраска комната девочки подростка";4;35;70;27
"дизайн комнаты девочки";3;22;24879;23
"фото комната девочки подростка";4;30;3892;26
"макет комнаты девочки подростка";4;31;63;29
"обои девочки в комнату";4;22;6426;22
"интерьер комнаты девочки";3;24;8409;19
"описание комнаты девочки подростка";4;34;84;20
"современная комната для девочки";4;31;2324;20
"описание комнаты подростка девочки";4;34;84;20
"девочка в игровой комнате";4;25;285;20
"комната для девочек детские";4;27;58156;19
"комната для маленькой девочки";4;29;3370;21
"комната белая для девочки";4;25;1164;20
"оформление комнаты девочки подростка";4;36;306;21
"комната для трех девочек";4;24;276;20
"комната для девочки стильная";4;28;228;22
"комната для девочки маленькой";4;29;3370;21
"комната девочки подростка раскраска";4;35;63;20
"оформление комнаты подростка девочки";4;36;306;21
"комната для 3 девочек";4;21;2056;22
"комната для девочки белая";4;25;1178;19
"рисунки комната подростка девочки";4;33;709;17
"дизайн девочки комнаты";3;22;24554;17
"комната девочки 15 лет";4;22;1474;18
"комнаты для девочек 12";4;22;7903;17
"комнаты девочек";2;15;142458;17
"рисунки комната девочки подростка";4;33;709;17
"проект комнаты подростка девочки";4;32;952;19
"молодежные комнаты для девочек";4;30;75;18
"комната для школьника девочки";4;29;338;19
"детский комната для девочки";4;27;60307;17
"комнаты для детей девочек";4;25;1071;19
"проект комнаты девочки подростка";4;32;952;19
"комната девочки 10 лет";4;22;3050;17
"комната для девочки школьника";4;29;338;19
"белая комната для девочки";4;25;1178;19
"презентация комнаты девочки подростка";4;37;677;17
"комната для девочки фиолетовая";4;30;270;16
"узкая комната для девочки";4;25;555;16
"дизайны комнат для девочек";4;26;25735;16
"мансарда комната для девочки";4;28;371;16
"комната для 10 девочки";4;22;4088;16
"комната для девочки мансарда";4;28;370;16
"смотреть для девочек комнаты";4;28;321;17
"комната для девочки 10";4;22;4088;16
"игровая комната для девочек";4;27;285;17
"комната девочки подростка рисунки";4;33;596;16
"комната девочки подростка планировка";4;36;555;17
"нарисовать комната девочки подростка";4;36;306;17
"комната мансарда для девочки";4;28;370;16
"план комнаты подростка девочки";4;30;122;17
"презентация комнаты подростка девочки";4;37;648;17
"комната девочки подростка доклад";4;32;94;16
"фото комната девочки";3;20;23195;14
"детские комната для девочек";4;27;60307;14
"комната для девочек игровая";4;27;264;15
"комнаты подростков девочек";3;26;36583;14
"комната для девочек двойняшек";4;29;168;15
"девочка подросток комната";3;25;29911;14
"комната для девочки современная";4;31;2184;15
"фиолетовая комната для девочки";4;30;260;15
"комната для девочки узкая";4;25;539;15
"комната для двойняшек девочек";4;29;168;15
"комната девочек";2;15;142460;15
"переделки комнаты для девочек";4;29;1616;15
"комнаты девочек подростков";3;26;36583;14
"бирюзовая комната для девочки";4;29;265;15
"доклад комната девочки подростка";4;32;94;16
"интерьер девочки комнаты";3;24;8245;14
"классные комнаты для девочек";4;28;174;13
"шторы для комнаты девочки";4;25;3088;13
"комната подростка девочка";3;25;33369;13
"нарисовать комнату девочки подростка";4;36;246;13
"комната девочки 14 лет";4;22;3277;13
"комната сиреневая для девочки";4;29;177;13
"комната подростка девочки нарисовать";4;36;230;14
"комната девочки фото";3;20;22519;13
"сиреневая комната для девочки";4;29;196;14
"подростковая комната для девочек";4;32;3195;13
"декор комнаты подростка девочки";4;31;363;14
"стильная комната для девочки";4;28;230;14
"комната для девочки бирюзовая";4;29;240;13
"комната для девочки мансардная";4;30;164;14
"декор комнаты девочки подростка";4;31;363;14
"комнаты классные для девочек";4;28;174;13
"комната винкс для девочек";4;25;86;12
"прикольные комнаты для девочек";4;30;158;12
"диван в комнату девочки";4;23;961;12
"план комнаты девочки подростка";4;30;109;12
"смотреть комнаты для девочек";4;28;337;12
"комната для девочек винкс";4;25;86;12
"комната для девочки 12";4;22;7904;12
"рисунки комнаты девочки подростка";4;33;568;12
"комнаты маленькие для девочек";4;29;3370;12
"комната для девочки сиреневая";4;29;190;12
"фото комнаты девочки";3;20;23195;12
"маленькие комнаты для девочек";4;29;3380;12
"винкс комната для девочек";4;25;86;12
"декор комнаты для девочек";4;25;1215;12
"комната мансардная для девочки";4;30;158;13
"комната для девочек пони";4;24;32;12
"комната подростков девочек";3;26;36583;11
"комната девочек подростков";3;26;36583;11
"девочки комната фото";3;20;21973;11
"мальчик и девочка комната";4;25;10236;11
"девочки комната 12 лет";4;22;4618;11
"комнату девочки подростка";3;25;33369;10
"планировка комнаты девочки";3;26;1718;10
"комната девочки рисунок";3;23;1353;10
"рисунок комната девочки";3;23;1353;10
"комната девочки лет 12";4;22;4618;11
"ремонт для комнаты девочки";4;26;2804;11
"ремонт комнаты для девочки";4;26;2804;11
"комнаты для девочек белые";4;25;1102;11
"комнаты для девочек детей";4;25;1015;11
"дизайнерские комнаты для девочек";4;32;155;11
"эскиз комната девочки подростка";4;31;78;11
"аксессуары для комнаты девочки";4;30;63;11
"чертеж комнаты девочки подростка";4;32;37;11
"комната для девочки первоклашки";4;31;31;11
"комната для первоклашки девочки";4;31;31;11
"эскиз комнаты девочки картинки";4;30;12;11
"комната девочки и мальчика";4;26;10527;10
"комната мальчика и девочки";4;26;10527;10
"комната на двух девочек";4;23;7523;10
"обои в комнату девочке";4;22;6889;10
"обои девочке в комнату";4;22;6889;10
"комната подростковая для девочек";4;32;3299;10
"комнаты для двоих девочек";4;25;1890;10
"комнаты для девочек двоих";4;25;1890;10
"рисунки для девочек комнаты";4;27;1095;10
"простая комната для девочки";4;27;421;10
"комната для девочки простая";4;27;384;10
"игровая комната для девочки";4;27;285;10
"идеальная комната для девочки";4;29;142;10
"дизайн комнаты школьника девочки";4;32;119;10
"комнаты для девочек прикольные";4;30;78;10
"комната для девочки младенца";4;28;52;10
"комната для младенца девочки";4;28;52;10
"комната для девочки тинейджера";4;30;44;10
"комната для тинейджера девочки";4;30;44;10
"комната тинейджера для девочки";4;30;44;10
"дизайн детской комнаты для девочки";5;34;13118;2482
"дизайн комнаты для девочки подростка";5;36;6773;909
"дизайн комнаты для подростка девочки";5;36;6773;909
"интерьер детской комнаты для девочки";5;36;3965;879
"детская комната для двух девочек";5;32;3954;617
"интерьер комнаты для подростка девочки";5;38;2382;579
"интерьер для комнаты девочки подростка";5;38;2382;579
"интерьер комнаты для девочки подростка";5;38;2382;579
"комнаты для девочек 12 лет";5;26;5404;286
"фото детские комнаты для девочек";5;32;14482;255
"мебель для комнаты девочки подростка";5;36;1162;252
"мебель для комнаты подростка девочки";5;36;1162;252
"фото детская комната для девочки";5;32;14482;244
"детские комнаты для девочек фото";5;32;14487;243
"детские комнаты фото для девочек";5;32;14487;243
"фото детских комнат для девочек";5;31;14482;235
"детская комната для девочки фото";5;32;14487;230
"ремонт детской комнаты для девочки";5;34;1590;233
"комната подростка девочки 14 лет";5;32;2011;222
"купить детскую комнату для девочки";5;34;3442;223
"комната для девочки 10 лет";5;26;3061;219
"комната для девочек своими руками";5;33;3486;218
"комната для девочки и мальчика";5;30;10763;186
"комната для мальчика и девочки";5;30;10763;186
"комната для подростков для девочек";5;34;34868;183
"фото детской комнаты для девочек";5;32;14482;160
"комната для девочки 12 лет";5;26;5404;155
"обои для комнаты девочки подростка";5;34;1181;152
"обои для комнаты подростка девочки";5;34;1181;152
"детская комната для двоих девочек";5;33;1382;150
"шторы в комнату девочки подростка";5;33;546;147
"шторы в комнату подростка девочки";5;33;546;147
"детская комната для девочки подростка";5;37;2083;145
"детская комната для подростка девочки";5;37;2083;145
"обои в комнату для девочек";5;26;7045;137
"обои для девочек в комнату";5;26;7045;137
"детские комнаты дизайн для девочек";5;34;13118;137
"детские комнаты для девочек дизайн";5;34;13118;137
"дизайн детские комнаты для девочек";5;34;13118;137
"комната мечты для девочки подростка";5;35;398;134
"комната мечты для подростка девочки";5;35;398;134
"идеи для комнаты девочки подростка";5;34;734;131
"идеи для комнаты подростка девочки";5;34;734;131
"идеи комнаты для девочки подростка";5;34;734;131
"идеи комнаты для подростка девочки";5;34;734;131
"комната девочки подростка 12 лет";5;32;1957;121
"комната подростка девочки 12 лет";5;32;1957;121
"мебель детская комната для девочки";5;34;6263;120
"маленькая детская комната для девочки";5;37;1442;117
"детская комната для девочки мебель";5;34;6154;117
"детская комната мебель для девочки";5;34;6154;117
"детская маленькая комната для девочки";5;37;1435;116
"комната для девочки 7 лет";5;25;1561;111
"дизайн подростковой комнаты для девочки";5;39;601;105
"оформление комнаты для девочки подростка";5;40;314;104
"оформление комнаты для подростка девочки";5;40;314;104
"комната для двух девочек подростков";5;35;905;103
"комната для двух подростков девочек";5;35;905;103
"дизайн комнаты для двух девочек";5;31;1988;101
"оформление детской комнаты для девочки";5;38;624;95
"красивые детские комнаты для девочек";5;36;491;91
"обои в комнату для девочки";5;26;7045;90
"обои для девочки в комнату";5;26;7045;90
"комнаты для девочки подростка декор";5;35;355;89
"комната для девочки подростка 12";5;32;2433;89
"комната детская для девочек фото";5;32;14594;82
"комната для 12 подростка девочки";5;32;2386;81
"идеи детской комнаты для девочки";5;32;885;81
"детская комната для девочек фото";5;32;14487;79
"детская комната фото для девочек";5;32;14487;79
"дизайн детской комнаты для девочек";5;34;13118;78
"игры для девочек переделки комнат";5;33;1645;77
"переделки комнат игры для девочек";5;33;1599;77
"комната для подростка девочки 12";5;32;2128;77
"фото детская комната для девочек";5;32;14482;76
"комнаты для девочек 2 девочек";5;29;3313;76
"комната для девочки 8 лет";5;25;1085;74
"комната маленькая для девочки подростка";5;39;772;73
"маленькая комната для девочки подростка";5;39;772;73
"маленькая комната для подростка девочки";5;39;772;73
"ремонт комнаты для девочки подростка";5;36;610;73
"ремонт комнаты для подростка девочки";5;36;610;73
"детские модульные комнаты для девочек";5;37;194;73
