"Ключевое слово";"Слов";"Символов";"Частотность Весь мир";"""!Частотность !Весь !мир"""
"комнаты для девочек для новорожденных";5;37;589;15
"комнаты для новорожденных для девочек";5;37;589;15
"проекты детских комнат для девочек";5;34;443;15
"делаем комнату игры для девочек";5;31;348;15
"игры делаем комнату для девочек";5;31;348;15
"игры для девочек делаем комнату";5;31;348;15
"идеи дизайна для комнаты девочки";5;32;294;15
"идеи дизайна комнаты для девочки";5;32;294;15
"идеи для дизайна комнаты девочки";5;32;294;15
"интерьер подростковой комнаты для девочек";5;41;288;15
"интерьеры подростковых комнат для девочек";5;41;288;15
"детская для девочки небольшая комната";5;37;219;15
"детская комната для девочки небольшая";5;37;211;15
"детская небольшая комната для девочки";5;37;211;15
"шторы для подростковой комнаты девочки";5;38;75;15
"аксессуары для комнаты для девочки";5;34;71;15
"уютная комната для девочки подростка";5;36;51;15
"уютная комната для подростка девочки";5;36;51;15
"дизайнерские комнаты для девочек подростков";5;43;41;15
"дизайнерские комнаты для подростков девочек";5;43;41;15
"интерьер комнат для девочек подростков";5;38;2670;14
"интерьер комнат для подростков девочек";5;38;2670;14
"шторы в комнату для девочки";5;27;3108;14
"шторы для девочки в комнату";5;27;3108;14
"комнаты для подростков девочек 14";5;33;2264;14
"фото комната для двух девочек";5;29;1396;14
"как сделать для девочки комнату";5;31;1494;14
"комнаты для девочек 8 лет";5;25;1085;14
"украшение для комнаты для девочки";5;33;655;14
"украшение для комнаты для девочек";5;33;660;14
"детская комната красивая для девочки";5;36;520;14
"подростковая комната для девочки фото";5;37;428;14
"детские комнаты для девочек современные";5;39;277;14
"комнаты для подростка девочки фотообои";5;38;132;14
"игры для девочек укрась комнату";5;31;120;14
"узкая комната для девочки подростка";5;35;111;14
"узкая комната для подростка девочки";5;35;111;14
"комната светлая для девочки подростка";5;37;114;14
"план комнаты для девочки подростка";5;34;95;14
"план комнаты для подростка девочки";5;34;95;14
"клип девочка в комнате танцует";5;30;91;14
"комната детская для трех девочек";5;32;80;14
"крутая комната для девочки подростка";5;36;62;14
"комнаты для девочек подростков дизайнерские";5;43;43;14
"моя комната для девочек фото";5;28;23124;13
"моя комната фото для девочек";5;28;23124;13
"интерьер в комнате девочки подростка";5;36;2382;13
"интерьер в комнате подростка девочки";5;36;2382;13
"стиль для комнаты девочки подростка";5;35;2107;13
"стиль комнаты для девочки подростка";5;35;2107;13
"стиль комнаты для подростка девочки";5;35;2107;13
"шторы детская комната для девочки";5;33;2208;13
"варианты детских комнат для девочки";5;35;1316;13
"фото комнат для двух девочек";5;28;1396;13
"комната для девочек 7 лет";5;25;1561;13
"комнаты для девочек 13 лет";5;26;1141;13
"детские комнаты 2 для девочек";5;29;1157;13
"детские комнаты для 2 девочек";5;29;1157;13
"детские комнаты для девочек 2";5;29;1055;13
"дизайн интерьер комнаты для девочки";5;35;580;13
"интерьер дизайн комнаты для девочки";5;35;582;13
"фото красивых комнат для девочек";5;32;327;13
"тюли для детской комнаты девочки";5;32;284;13
"комнаты для девочек 18 лет";5;26;270;13
"игры дизайн для девочек комнат";5;30;221;13
"интерьер для комнаты 2 девочек";5;30;154;13
"интерьер комнаты для 2 девочек";5;30;154;13
"комната узкая для подростка девочки";5;35;110;13
"девочка танцует в комнате клип";5;30;113;13
"клип девочка танцует в комнате";5;30;108;13
"клип танцует девочка в комнате";5;30;108;13
"детская комната для девочки школьницы";5;37;102;13
"готовые детские комнаты для девочек";5;35;106;13
"дизайн комнаты для девочки новорожденной";5;40;75;13
"дизайн комнаты для новорожденной девочки";5;40;75;13
"детская мансардная комната для девочки";5;38;74;13
"какие бывают комнаты для девочек";5;32;43;13
"какие комнаты бывают для девочек";5;32;43;13
"игры украшение комнаты для девочек";5;34;18;13
"эскиз комнаты девочки подростка сверху";5;38;13;13
"комната для девочки своими руками";5;33;3486;12
"комната детская для подростков девочек";5;38;2151;12
"интерьер комната подростка для девочки";5;38;2459;12
"комната 13 лет для девочек";5;26;1141;12
"комната для девочек 13 лет";5;26;1141;12
"фотообои в комнату для девочки";5;30;1079;12
"фотообои для девочки в комнату";5;30;1079;12
"ковер в комнату для девочки";5;27;1129;12
"комната для девочки лет 6";5;25;593;12
"шторы в комнату девочке подростку";5;33;546;12
"шторы в комнату подростку девочке";5;33;546;12
"детская комната для девочки красивая";5;36;458;12
"как украсить комнату девочки подростка";5;38;398;12
"как украсить комнату подростка девочки";5;38;398;12
"комната подростковая для девочки фото";5;37;438;12
"комната для девочки на мансарде";5;31;396;12
"комната на мансарде для девочки";5;31;396;12
"моя комната видео от девочек";5;28;410;12
"цвет для комнаты девочки подростка";5;34;330;12
"цвет комнаты для девочки подростка";5;34;330;12
"цвет комнаты для подростка девочки";5;34;330;12
"недорогие детские комнаты для девочек";5;37;173;12
"оформление комнаты на годик девочке";5;35;174;12
"комната мальчика и девочки совместно";5;36;171;12
"люстры в комнату девочки подростка";5;34;142;12
"люстры в комнату подростка девочки";5;34;142;12
"комната небольшая для девочки подростка";5;39;128;12
"для девочек дизайнер комнаты игры";5;33;104;12
"розовая комната для девочки подростка";5;37;101;12
"розовая комната для подростка девочки";5;37;101;12
"светильники для детской комнаты девочки";5;39;90;12
"оформление комнаты девочке на годик";5;35;91;12
"детская комната для трех девочек";5;32;80;12
"комната для девочки школьника фото";5;34;73;12
"комната для школьника девочки фото";5;34;73;12
"украшение комнаты на выписку девочки";5;36;74;12
"детская комната для девочки младенца";5;36;26;12
"детская комната для младенца девочки";5;36;26;12
"описание комнаты девочки подростка сочинение";5;44;13;12
"описание комнаты подростка девочки сочинение";5;44;13;12
"обои для комнаты для девочек";5;28;7045;11
"дизайн комнат для двух девочек";5;30;1988;11
"комнаты для девочек 7 лет";5;25;1561;11
"как сделать комнату для девочки";5;31;1615;11
"детская комната на двоих девочек";5;32;1382;11
"комната для девочек 11 лет";5;26;1257;11
"для девочек комната моей мечты";5;30;922;11
"украшения для комнаты для девочки";5;33;684;11
"комната для девочки подростка рисунок";5;37;511;11
"фото подростковая комната для девочки";5;37;457;11
"подростковая комната фото для девочки";5;37;457;11
"рисунок комната для девочки подростка";5;37;447;11
"комната мечты рисунок для девочки";5;33;328;11
"фото комнат красивых для девочек";5;32;325;11
"картинки детские комнаты для девочек";5;36;284;11
"как оформить комнату девочки подростка";5;38;259;11
"как оформить комнату подростка девочки";5;38;259;11
"детская комната для девочки прованс";5;35;225;11
"дизайн комнат игры для девочек";5;30;220;11
"игры дизайн комнат для девочек";5;30;220;11
"игры для девочек дизайн комнат";5;30;220;11
"фотообои для комнаты девочки подростка";5;38;169;11
"фотообои для комнаты подростка девочки";5;38;169;11
"зонирование комнаты детской для девочки";5;39;159;11
"обустраивать комнаты игры для девочек";5;37;157;11
"детская комната для девочки мансарда";5;36;157;11
"детская комната мансарда для девочки";5;36;157;11
"небольшая комната для девочки подростка";5;39;121;11
"небольшая комната для подростка девочки";5;39;121;11
"стол в комнату девочки подростка";5;32;115;11
"комната для подростка девочки голубая";5;37;96;11
"стильные комнаты для девочек подростков";5;39;98;11
"стильные комнаты для подростков девочек";5;39;98;11
"как обставить комнату девочки подростка";5;39;90;11
"как обставить комнату подростка девочки";5;39;90;11
"дизайнер детской комнаты для девочки";5;36;68;11
"крутые комнаты для девочек подростков";5;37;65;11
"комнаты для девочек с качелями";5;30;64;11
"комната для девочки подростка крутая";5;36;62;11
"крутые комнаты для подростков девочек";5;37;51;11
"маленькая подростковая комната для девочки";5;42;46;11
"нежная детская комната для девочки";5;34;46;11
"тюль в комнату девочки подростка";5;32;44;11
"тюль в комнату подростка девочки";5;32;44;11
"дизайнер комнаты для девочки подростка";5;38;41;11
"дизайнер комнаты для подростка девочки";5;38;41;11
"дизайнер для комнаты девочки подростка";5;38;27;11
"дизайнер комнаты подростка для девочки";5;38;27;11
"фото моя комната для девочек";5;28;21973;10
"детские для девочки комнаты фото";5;32;14487;10
"детские комнаты для девочки фото";5;32;14487;10
"детские комнаты фото для девочки";5;32;14487;10
"комнаты для девочки и мальчика";5;30;10762;10
"комнаты для мальчика и девочки";5;30;10762;10
"комната для девочек подростков фото";5;35;4359;10
"комната для подростков девочек фото";5;35;4359;10
"комната фото для девочек подростков";5;35;4359;10
"фото комната для девочек подростков";5;35;4158;10
"интерьер для комнаты девочек подростков";5;39;2766;10
"детская комната для девочек подростков";5;38;2135;10
"детская комната для подростков девочек";5;38;2135;10
"фото интерьер для комнаты девочки";5;33;1446;10
"интерьер фото комнаты для девочки";5;33;1446;10
"фото комнаты для двух девочек";5;29;1396;10
"люстра в комнату для девочки";5;28;1066;10
"детская комната для девочки маленькой";5;37;1208;10
"комната для девочки подростка проект";5;36;910;10
"проект комната для девочки подростка";5;36;913;10
"для девочек бесплатно игры комнаты";5;34;799;10
"игры для комнаты девочек бесплатно";5;34;799;10
"один годик девочке украсить комнату";5;35;487;10
"проекты детской комнаты для девочки";5;35;443;10
"дизайн комнаты для 3 девочек";5;28;338;10
"белая детская комната для девочки";5;33;350;10
"детская белая комната для девочки";5;33;350;10
"детская комната белая для девочки";5;33;350;10
"детская комната для девочки белая";5;33;350;10
"интерьер комнаты девочки подростка фото";5;39;316;10
"интерьер комнаты подростка девочки фото";5;39;316;10
"детские комнаты для девочек картинки";5;36;277;10
"детские комнаты картинки для девочек";5;36;277;10
"интерьеры для подростковых комнат девочек";5;41;277;10
"картинки детская комната для девочки";5;36;284;10
"интерьер комнаты подростка фото девочки";5;39;257;10
"обустроить детскую комнату для девочки";5;38;196;10
"планировка комнаты для двух девочек";5;35;192;10
"дизайн узкой комнаты для девочки";5;32;188;10
"диван в комнату подростка девочки";5;33;174;10
"прямоугольная детская комната для девочки";5;41;157;10
"дизайн прямоугольной комнаты для девочки";5;40;148;10
"как девочки показывают свою комнату";5;35;85;10
"детские комнаты для девочек готовые";5;35;82;10
"самые лучшие комнаты для девочек";5;32;77;10
"комната для девочки на даче";5;27;72;10
"комната на даче для девочки";5;27;72;10
"комната для девочки подростка фиолетовая";5;40;71;10
"комната для подростка девочки фиолетовая";5;40;71;10
"примеры детских комнат для девочек";5;34;73;10
"комната для девочки 13 метров";5;29;63;10
"комната девочки подростка вид сверху";5;36;61;10
"сиреневая детская комната для девочки";5;37;62;10
"для девочек игры обставь комнату";5;32;54;10
"игры для девочек обставь комнату";5;32;54;10
"игры обставь комнату для девочек";5;32;54;10
"детская комната для двойняшек девочек";5;37;51;10
"детская комната для девочек двойняшек";5;37;51;10
"крутая комната для подростка девочки";5;36;49;10
"подростковая маленькая комната для девочки";5;42;45;10
"декор комнаты девочки 12 лет";5;28;43;10
"оформление комнаты для подростковой девочки";5;43;33;10
"аксессуары для комнаты девочки подростка";5;40;30;10
"аксессуары для комнаты подростка девочки";5;40;30;10
"девочка в игровой комнате видео";5;31;18;10
"видео девочка в игровой комнате";5;31;18;10
"украшение комнаты для новорожденной девочки";5;43;14;10
"мебель для детской комнаты для девочки";6;38;6326;1445
"обои в детскую комнату для девочек";6;34;3987;883
"детские комнаты для девочек дизайн фото";6;39;5036;845
"детские комнаты для девочек фото дизайн";6;39;5036;845
"дизайн для детской комнаты для девочки";6;38;13121;808
"мебель в детскую комнату для девочек";6;36;6326;637
"детская комната для девочки и мальчика";6;38;6302;606
"детская комната для мальчика и девочки";6;38;6302;606
"дизайн детской комнаты для двух девочек";6;39;1351;459
"комната для девочки подростка 12 лет";6;36;1864;455
"комната для подростка девочки 12 лет";6;36;1864;455
"мебель для подростковой комнаты для девочки";6;43;760;440
"обои для детской комнаты для девочек";6;36;3987;431
"комната для девочки подростка 14 лет";6;36;1960;431
"комната для подростка девочки 14 лет";6;36;1960;431
"детская комната для девочки дизайн фото";6;39;5036;367
"детская комната для девочки фото дизайн";6;39;5036;367
"шторы в детскую комнату для девочки";6;35;2194;358
"интерьер для детской комнаты для девочек";6;40;4006;331
"детские ковры в комнату для девочек";6;35;1023;234
"обои в комнату для девочки подростка";6;36;1199;229
"обои в комнату для подростка девочки";6;36;1199;230
"обои для девочки подростка в комнату";6;36;1199;230
"фотообои в детскую комнату для девочек";6;38;741;215
"люстра в детскую комнату для девочки";6;36;851;210
"шкаф в детскую комнату для девочки";6;34;1076;188
"интерьер детской комнаты для девочек фото";6;41;835;181
"интерьер детской комнаты фото для девочек";6;41;835;181
"люстры в детскую комнату для девочки";6;36;851;166
"интерьер для комнаты для девочки подростка";6;42;2275;163
"детская комната для девочки подростка фото";6;42;449;147
"комната для девочки и мальчика вместе";6;37;1567;144
"комната для мальчика и девочки вместе";6;37;1567;144
"занавески в детскую комнату для девочки";6;39;327;143
"дизайн детской комнаты для маленькой девочки";6;44;408;140
"дизайн детской маленькой комнаты для девочки";6;44;408;140
"дизайн маленькой детской комнаты для девочки";6;44;408;140
"детская комната для двоих девочек фото";6;38;362;138
"игры для девочек моя новая комната";6;34;849;125
"ковер в детскую комнату для девочки";6;35;1023;112
"шторы для детской комнаты для девочек";6;37;2194;112
"интерьер детской комнаты для двух девочек";6;41;348;111
"дизайн детских комнат для девочек фото";6;38;5036;103
"дизайн детских комнат фото для девочек";6;38;5036;103
"обои детские для девочек в комнату";6;34;3987;100
"идеи для детской комнаты для девочки";6;36;892;100
"дизайн интерьера детской комнаты для девочки";6;44;252;100
"мебель для детской комнаты для девочек";6;38;6326;96
"обои для подростковой комнаты для девочки";6;41;270;97
"дизайн детской комнаты для девочки фото";6;39;5036;96
"диван в детскую комнату для девочки";6;35;595;96
"потолок в детской комнате для девочки";6;37;759;90
"интерьер для подростковой комнаты для девочек";6;45;296;89
"идеи для детской комнаты для девочек";6;36;892;86
"кровать в детскую комнату для девочки";6;37;703;85
"детская комната дизайн фото для девочек";6;39;5036;84
"детская комната для девочек дизайн фото";6;39;5036;84
"детская комната фото дизайн для девочек";6;39;5036;84
"как оформить детскую комнату для девочки";6;40;365;79
"шкафы в детскую комнату для девочек";6;35;1076;77
"комната для девочек разного возраста фото";6;41;503;77
"интерьер подростковой комнаты для девочек фото";6;46;114;76
"интерьер подростковой комнаты фото для девочек";6;46;114;76
"ковер в детскую комнату для девочек";6;35;1023;72
"как оформить комнату для девочки подростка";6;42;262;72
"как оформить комнату для подростка девочки";6;42;262;72
"комната детская мебель для 2 девочек";6;36;121;72
"идеи для комнаты для девочки подростка";6;38;720;71
"идеи для комнаты для подростка девочки";6;38;720;71
"комната для двух девочек разного возраста";6;41;760;71
"дизайн комнаты для девочки 10 лет";6;33;626;71
"ковры в детскую комнату для девочки";6;35;1023;70
"мебель детская комната для девочки фото";6;39;476;69
"шкаф для девочки подростка в комнату";6;36;242;69
"часы в детскую комнату для девочки";6;34;111;68
"тюль в детскую комнату для девочки";6;34;281;68
"ремонт в детской комнате для девочек";6;36;1586;67
"дизайн детской комнаты для девочки подростка";6;44;362;67
"дизайн детской комнаты для подростка девочки";6;44;362;67
"шкаф в комнату для подростка девочки";6;36;238;67
"детская комната для двух девочек фото";6;37;970;65
