"Ключевое слово";"Слов";"Символов";"Частотность Весь мир";"""!Частотность !Весь !мир"""
"фотообои в комнату для девочек фото";6;35;221;10
"фотообои для девочек в комнату фото";6;35;221;10
"комната детская для девочки 11 лет";6;34;225;10
"дизайн комнаты для девочки 13 лет";6;33;216;10
"комната для девочки подростка с окном";6;37;185;10
"комната для девочки подростка 13 лет";6;36;182;10
"комната для подростка девочки 13 лет";6;36;182;10
"комната с окном для подростка девочки";6;37;180;10
"украшение комнаты девочки на день рождения";6;42;179;10
"комната для девочки и мальчика совместная";6;41;159;10
"совместная комната для девочки и мальчика";6;41;157;10
"совместная комната для мальчика и девочки";6;41;157;10
"идеи детской комнаты для девочки фото";6;37;160;10
"идеи для детской комнаты девочки фото";6;37;160;10
"красивая детская комната для девочки фото";6;41;147;10
"люстра в комнату для девочки подростка";6;38;146;10
"как украсить детскую комнату для девочки";6;40;142;10
"комната в белых тонах для девочки";6;33;127;10
"комната для девочки в белых тонах";6;33;127;10
"детские комнаты для девочек школа ремонта";6;41;111;10
"комната современная для подростка девочки фото";6;46;108;10
"цветы в детскую комнату для девочек";6;35;105;10
"комната для девочки 12 летней девочки";6;37;92;10
"комната для девочки подростка на мансарде";6;41;92;10
"комната для подростка девочки на мансарде";6;41;92;10
"комната на мансарде для девочки подростка";6;41;92;10
"в голубых тонах комната для девочки";6;35;87;10
"комната для девочки в стиле минимализм";6;38;79;10
"мебель для комнаты девочки подростка фото";6;41;80;10
"мебель для комнаты подростка девочки фото";6;41;80;10
"мебель для подростка девочки комнаты фото";6;41;80;10
"детская комната для девочки на чердаке";6;38;55;10
"идеи для интерьера комнаты для девочки";6;38;54;10
"картинки комнат для девочек 14 лет";6;34;45;10
"комната школьника дизайн фото для девочек";6;41;42;10
"простой дизайн детской комнаты для девочки";6;42;40;10
"дизайн детской комнаты для девочки простой";6;42;39;10
"цветовая гамма детской комнаты для девочки";6;42;24;10
"цветовая гамма для детской комнаты девочки";6;42;24;10
"комната девочки подростка в стиле лондон";6;40;24;10
"игры для девочек переделки домов и комнат";7;41;1187;636
"игры для девочек переделки комнат и домов";7;41;1187;636
"детская комната для девочки и для мальчика";7;42;6313;469
"шторы в детскую комнату для девочки фото";7;40;1073;380
"обои для детской комнаты для девочек фото";7;41;854;377
"обои для детской комнаты фото для девочек";7;41;854;377
"купить мебель в детскую комнату для девочки";7;43;1142;374
"детские комнаты для 8 лет для девочек";7;37;650;333
"детские комнаты для девочек 8 лет фото";7;38;440;330
"детские комнаты для девочек фото 8 лет";7;38;440;330
"детские комнаты фото для девочек 8 лет";7;38;440;330
"комната девочки подростка планировка и дизайн фото";7;50;367;324
"декор для комнаты своими руками для девочки";7;43;606;315
"шторы для детской комнаты для девочек фото";7;42;1073;239
"детская комната для девочки и мальчика фото";7;43;1423;162
"детская комната для мальчика и девочки фото";7;43;1423;162
"декор для комнаты девочки подростка своими руками";7;49;212;156
"декор для комнаты подростка девочки своими руками";7;49;212;156
"декор комнаты для девочки подростка своими руками";7;49;212;156
"декор комнаты для подростка девочки своими руками";7;49;212;156
"декор комнаты своими руками для девочки подростка";7;49;212;156
"декор своими руками для комнаты девочки подростка";7;49;212;156
"купить мебель для детской комнаты для девочки";7;45;1142;154
"мебель для детской комнаты для девочки купить";7;45;1142;154
"детская комната для мальчика и девочки вместе";7;45;953;149
"комнаты для девочек 14 лет дизайн фото";7;38;417;136
"дизайн детской комнаты для девочки и мальчика";7;45;1351;128
"дизайн детской комнаты для мальчика и девочки";7;45;1351;128
"комната для мальчика и для девочки фото";7;39;1768;126
"мебель для маленькой детской комнаты для девочки";7;48;199;126
"мебель для детской комнаты для девочки подростка";7;48;297;112
"игры для девочек делать дома и комнаты";7;38;193;110
"игры для девочек делать комнаты и дома";7;38;193;110
"мебель в детскую комнату для девочек фото";7;41;466;102
"своими руками для детской комнаты для девочки";7;45;670;95
"мебель для детской комнаты для двух девочек";7;43;241;95
"дизайн комнаты для девочки подростка 12 лет";7;43;659;92
"дизайн комнаты для подростка девочки 12 лет";7;43;659;92
"обои в детскую комнату для девочек фото";7;39;854;92
"обои в детскую комнату фото для девочек";7;39;854;92
"обои для в комнату для девочки подростка";7;40;1239;91
"ремонт в детской комнате для девочек фото";7;41;523;90
"ремонт в детской комнате фото для девочек";7;41;523;90
"оформление детской комнаты для мальчика и девочки";7;49;130;86
"дизайн для комнаты девочки подростка 14 лет";7;43;583;82
"дизайн комнаты для девочки и мальчика вместе";7;44;356;82
"дизайн комнаты для мальчика и девочки вместе";7;44;356;82
"комната для девочки подростка 14 лет дизайн";7;43;622;81
"люстры в детскую комнату для девочки купить";7;43;225;81
"купить обои для детской комнаты для девочек";7;43;451;78
"обои для детской комнаты для девочек купить";7;43;451;78
"шкаф купе в детскую комнату для девочки";7;39;261;77
"купить обои в детскую комнату для девочек";7;41;451;76
"обои в детскую комнату для девочек купить";7;41;451;76
"детская комната для девочки фото и варианты";7;43;882;75
"фотообои для детской комнаты для девочек фото";7;45;171;72
"фотообои для детской комнаты фото для девочек";7;45;171;72
"купить мебель для подростковой комнаты для девочки";7;50;111;71
"мебель для подростковой комнаты для девочки купить";7;50;111;71
"комната для двух девочек разного возраста фото";7;46;287;69
"модульная мебель для детской комнаты для девочки";7;48;97;67
"купить шторы в детскую комнату для девочки";7;42;181;66
"шторы в детскую комнату для девочки купить";7;42;181;66
"дизайн штор для детской комнаты для девочки";7;43;103;65
"игры для девочек моя новая комната 3";7;36;340;61
"комната для девочки подростка 16 лет фото";7;41;219;59
"комната для подростка девочки 16 лет фото";7;41;219;59
"осенний декор комнаты для девочки своими руками";7;47;66;59
"интерьер комнаты для мальчика и для девочки";7;43;725;58
"шкаф в детскую комнату для девочки угловой";7;42;203;58
"дизайн комнаты для девочки подростка 16 лет";7;43;381;56
"дизайн комнаты для подростка девочки 16 лет";7;43;381;56
"корпусная мебель для детской комнаты для девочек";7;48;69;56
"интерьер детской комнаты фото для девочек фото";7;46;834;54
"интерьер для детской комнаты для девочек фото";7;45;834;54
"игры для девочек строить дома и комнаты";7;39;489;54
"игры строить дома и комнаты для девочек";7;39;489;54
"ковер в детскую комнату для девочек купить";7;42;282;54
"игры для девочек обустраивать дома и комнаты";7;44;115;54
"игры для девочек обустраивать комнаты и дома";7;44;115;54
"дизайн комнаты для двух девочек разного возраста";7;48;225;53
"занавески в детскую комнату для девочки фото";7;44;80;52
"занавески в детскую комнату фото для девочки";7;44;80;52
"белая мебель для детской комнаты для девочки";7;44;136;51
"интерьер детской комнаты для девочки и мальчика";7;47;533;50
"интерьер детской комнаты для мальчика и девочки";7;47;533;50
"угловой шкаф в детскую комнату для девочки";7;42;197;50
"как украсить комнату для девочки своими руками";7;46;1175;49
"как украсить комнату своими руками для девочки";7;46;1175;49
"дизайн для детской комнаты для девочки подростка";7;48;360;48
"люстра в детскую комнату для девочки купить";7;43;225;48
"купить ковер в детскую комнату для девочек";7;42;244;47
"идеи для комнаты для девочки и мальчика";7;39;158;47
"купить мебель в детскую комнату для девочек";7;43;1142;46
"мебель в детскую комнату для девочек купить";7;43;1142;46
"дизайн детской для двух девочек комнаты фото";7;44;302;46
"дизайн комнаты для детской двух девочек фото";7;44;302;46
"комната для девочки подростка 12 лет дизайн";7;43;659;45
"комната для подростка девочки 12 лет дизайн";7;43;659;45
"осенний декор комнаты своими руками для девочки";7;47;50;45
"идеи для детской комнаты для девочек фото";7;41;152;44
"чем отличается комната девочки подростка от спальни";7;51;97;44
"фото комнаты для девочек 12 лет подростка";7;41;505;43
"идеи для комнаты для девочки своими руками";7;42;178;43
"комната для девочки подростка в стиле лофт";7;42;82;43
"комната для подростка девочки в стиле лофт";7;42;82;43
"купить диван в детскую комнату для девочки";7;42;73;43
"диван в детскую комнату для девочки купить";7;42;79;43
"как своими руками украсить комнату для девочки";7;46;1154;42
"дизайн детской комнаты для девочки 10 лет";7;41;267;42
"детская комната в стиле прованс для девочек";7;43;147;42
"дизайн для маленькой детской комнаты для девочки";7;48;405;41
"дизайн для детской комнаты для девочки 10";7;41;447;41
"мебель для подростка девочки в комнату в";7;40;1223;40
"как украсить комнату девочки на день рождения";7;45;1335;40
"как украсить комнату на день рождения девочки";7;45;1335;40
"купить мебель для детской комнаты для девочек";7;45;1142;39
"мебель для детской комнаты для девочек купить";7;45;1142;39
"дизайн комнаты для девочки подростка в современном";7;50;1023;39
"дизайн проект детской комнаты для двух девочек";7;46;72;39
"проект дизайн детской комнаты для двух девочек";7;46;72;39
"фото интерьер детской комнаты для двух девочек";7;46;103;39
"детские комнаты для девочек купить в москве";7;43;259;38
"римские шторы в детскую комнату для девочки";7;43;72;38
"шторы в детскую комнату для девочки подростка";7;45;77;37
"какие обои выбрать для детской комнаты девочки";7;46;88;37
"детские комнаты для девочек для 2 девочек";7;41;1055;36
"фото комнаты для девочки 10 лет фото";7;36;674;36
"как украсить своими руками комнату девочки подростка";7;52;345;36
"дизайн комнаты для девочек 12 лет фото";7;38;511;36
"игры для девочек моя новая комната 2";7;36;296;36
"игры для девочек переделки комнаты для девочек";7;46;1640;35
"детские комнаты для девочки и мальчика вместе";7;45;953;35
"детские комнаты для мальчика и девочки вместе";7;45;953;35
"дизайн комнаты для девочки подростка 14 лет";7;43;622;35
"дизайн комнаты для подростка девочки 14 лет";7;43;622;35
"интерьер детской комнаты для девочки 10 лет";7;43;91;35
"обои в комнату для девочки 7 лет";7;32;123;35
"обои для девочки 7 лет в комнату";7;32;123;35
"декор детской комнаты для девочки своими руками";7;47;80;35
"игры для девочек переделки дома и комнаты";7;41;1187;34
"игры для девочек переделки комнаты и дома";7;41;1187;34
"комната для девочки подростка 12 лет фото";7;41;505;34
"комната для подростка девочки 12 лет фото";7;41;505;34
"потолок натяжной в детскую комнату для девочки";7;46;380;34
"комнаты для девочек подростков 16 лет фото";7;42;220;34
"комнаты для подростков девочек 16 лет фото";7;42;220;34
"дизайн для детской комнаты для двоих девочек";7;44;236;34
"дизайн комнаты для девочки и мальчика подростков";7;48;177;34
"дизайн комнаты для мальчика и девочки подростков";7;48;177;34
"дизайн комнаты для подростков девочки и мальчика";7;48;177;34
"дизайн комнаты для подростков мальчика и девочки";7;48;177;34
"фотообои в детскую комнату для девочек фото";7;43;171;34
"детская комната дизайн для мальчика и девочки";7;45;1351;33
"детская комната для девочки и мальчика дизайн";7;45;1351;33
"детская комната для мальчика и девочки дизайн";7;45;1351;33
"купить детские комнаты для девочек в москве";7;43;250;33
"натяжной потолок в детскую комнату для девочки";7;46;387;33
"идеи для комнаты девочки подростка своими руками";7;48;79;33
"идеи для комнаты подростка девочки своими руками";7;48;79;33
"идеи комнаты для девочки подростка своими руками";7;48;79;33
"обои в детскую комнату для девочек подростков";7;45;85;33
"зонирование детской комнаты для девочки и мальчика";7;50;57;33
"зонирование детской комнаты для мальчика и девочки";7;50;57;33
"ковер в детскую комнату для девочки купить";7;42;282;32
"купить ковер в детскую комнату для девочки";7;42;282;32
"интерьер для детской комнаты для двух девочек";7;45;342;32
"обои для девочек в комнату 7 лет";7;32;123;32
"игры для девочек обстановка комнаты и дома";7;42;44;32
"шкаф в детскую комнату для девочки белый";7;40;39;32
"как украсить на день рождения комнату девочки";7;45;1325;31
"купить обои в детскую комнату для девочки";7;41;451;31
"обои в детскую комнату для девочки купить";7;41;451;31
"как украсить комнату девочке на 1 годик";7;39;218;31
"как украсить комнату на 1 годик девочке";7;39;214;31
"обои в комнату для девочки подростка фото";7;41;129;31
"обои в комнату для подростка девочки фото";7;41;129;31
"обои для девочки подростка в комнату фото";7;41;129;31
"кровать диван в детскую комнату для девочки";7;43;75;31
"диван кровать в детскую комнату для девочки";7;43;71;31
"комнаты детские для девочки и мальчика вместе";7;45;939;30
"детской комнаты для двух девочек фото дизайн";7;44;323;30
"комнаты детские для девочек фото для 2";7;38;307;30
"мебель для детской комнаты мальчика и девочки";7;45;196;30
"диван в детскую комнату для подростка девочки";7;45;75;30
"дизайн детской комнаты для двух подростков девочек";7;50;44;30
"детские комнаты для мальчиков и для девочек";7;43;5950;29
"комнаты для девочек 12 лет фото дизайн";7;38;492;29
"фото комната для подростка девочки 14 лет";7;41;400;29
"детская комната для 2 девочек дизайн фото";7;41;171;29
"детская комната для 2 девочек фото дизайн";7;41;171;29
"игры для девочек делаем дома и комнаты";7;38;193;29
"игры для девочек делаем комнаты и дома";7;38;193;29
"дизайн детской комнаты для девочки школьного возраста";7;53;153;29
"детская комната для девочки в хрущевке дизайн";7;45;133;29
"диван в детскую комнату для девочки подростка";7;45;70;29
"обои в комнату для девочки 14 лет";7;33;79;29
"мебель для детской комнаты для девочки модульная";7;48;61;29
"комнаты для девочек подростков 12 лет фото";7;42;518;28
"комнаты для подростков девочек 12 лет фото";7;42;518;28
"детские комнаты дизайн для двух девочек фото";7;44;374;28
"детские комнаты дизайн фото для двух девочек";7;44;374;28
"детские комнаты для двух девочек дизайн фото";7;44;374;28
"детские комнаты для двух девочек фото дизайн";7;44;374;28
"как украсить комнату девочки подростка своими руками";7;52;322;28
"как украсить комнату подростка девочки своими руками";7;52;322;28
"детская комната для девочки 11 кв м";7;35;132;28
"кровать в детскую комнату для девочки купить";7;44;67;28
"купить кровать в детскую комнату для девочки";7;44;67;28
"дизайн детской комнаты для двух девочек фото";7;44;374;27
"дизайн детской комнаты фото для двух девочек";7;44;374;27
"фото дизайн детской комнаты для двух девочек";7;44;378;27
"шкафы купе в детскую комнату для девочки";7;40;261;27
"обои в комнату для девочки 10 лет";7;33;184;27
"обои для девочки 10 лет в комнату";7;33;184;27
"дизайн комнаты для девочки подростка 13 лет";7;43;76;27
"дизайн комнаты для подростка девочки 13 лет";7;43;76;27
"дизайн для детской комнаты девочки 11 лет";7;41;72;27
"интерьер комнаты для девочки подростка 16 лет";7;45;64;27
"интерьер комнаты для подростка девочки 16 лет";7;45;64;27
"фото детских комнат для девочек 12 лет";7;38;323;26
"дизайн для детской комнаты для 2 девочек";7;40;295;26
"угловые шкафы в детскую комнату для девочек";7;43;197;26
"шкаф для детской комнаты для девочек фото";7;41;181;26
"шкаф для детской комнаты фото для девочек";7;41;181;26
"дизайн детской комнаты для девочки 5 лет";7;40;120;26
"игры для девочек дизайн дома и комнаты";7;38;59;26
"игры для девочек дизайн комнаты и дома";7;38;59;26
"игры для девочек моя новая комната 5";7;36;289;25
"дизайн комнаты 9 кв м для девочки";7;33;299;25
"шкаф для девочки подростка в комнату в";7;38;240;25
"комната для девочки 10 лет дизайн фото";7;38;184;25
"дизайн детской комнаты для девочек разного возраста";7;51;217;25
"детские комнаты в классическом стиле для девочек";7;48;108;25
"фото комната для девочки в стиле прованс";7;40;67;25
