"Ключевое слово";"Слов";"Символов";"Частотность Весь мир";"""!Частотность !Весь !мир"""
"бойлер косвенного нагрева схема подключения к газовому котлу";8;60;139;12
"схема подключения газового котла с бойлером косвенного нагрева";8;62;133;11
"правильное подключение бойлера косвенного нагрева к газовому котлу";8;66;10;10
"что лучше бойлер или газовая колонка в частном доме";9;51;66;42
"что лучше газовая колонка или бойлер в частном доме";9;51;66;42
"одноконтурный газовый котел с бойлером или двухконтурный с бойлером";9;67;68;27
"газовый котел одноконтурный с бойлером или двухконтурный с бойлером";9;67;71;27
"котел газовый одноконтурный с бойлером или двухконтурный с бойлером";9;67;71;27
"двухконтурный газовый котел или одноконтурный с бойлером или двухконтурный";9;74;62;22
"газовый котел двухконтурный или одноконтурный с бойлером или двухконтурный";9;74;64;19
"какой газовый котел лучше одноконтурный с бойлером или двухконтурный";9;68;20;18
"как разместить бойлер и газовый котел в частном доме";9;52;17;17
"бойлер косвенного нагрева на 100 литров для газового котла";9;58;18;14
"как к газовому котлу подключить бойлер косвенного нагрева к";9;59;47;13
"одноконтурный газовый котел с бойлером косвенного нагрева схема подключения";9;75;16;12
"газовые котлы с бойлером для отопления частного дома как выбрать";10;64;23;21
"газовые котлы для отопления частного дома с бойлером как выбрать";10;64;13;10
"газовый бойлер прямого нагрева или бойлер косвенного нагрева что лучше";10;70;10;10
