"Ключевое слово";"Слов";"Символов";"Частотность Весь мир";"""!Частотность !Весь !мир"""
"бойлер газовый";2;14;12361;332
"газовый бойлер купить";3;21;1078;71
"котел газовый с бойлером";4;24;5739;71
"бойлер накопительный газовый";3;28;717;91
"купить бойлер газовый";3;21;1078;71
"бойлер аристон газовый 200 литров";5;33;225;73
"бойлер газовый купить";3;21;1078;71
"бойлер для нагрева воды газовый";5;31;685;196
"газовый бойлер накопительный";3;28;717;91
"накопительный газовый бойлер";3;28;717;91
"газовый котел с бойлером";4;24;5739;71
"газовый бойлер для нагрева воды";5;31;685;196
"газовый накопительный бойлер";3;28;717;91
"купить газовый бойлер";3;21;1078;71
"бойлер газовый накопительный";3;28;717;91
"газовый бойлер";2;14;12361;332
"что лучше газовая колонка или бойлер";6;36;224;61
"бойлер для газового котла";4;25;5747;51
"бойлер газовый цена";3;19;825;52
"бойлер газовый аристон";3;22;767;58
"газовый бойлер цена";3;19;825;52
"газовый бойлер аристон 200 литров цена";6;38;64;55
"бойлер газовый 200 литров цена";5;30;165;52
"котел газовый с бойлером косвенного нагрева";6;43;1650;59
"газовые бойлеры";2;15;12361;55
"аристон газовый бойлер";3;22;767;58
"бойлер аристон 200 литров газовый цена";6;38;64;55
"газовая колонка или бойлер что лучше";6;36;219;61
"газовый котел с бойлером косвенного нагрева";6;43;1458;59
"газовый бойлер 200 литров цена";5;30;165;52
"газовый бойлер аристон";3;22;767;58
"что лучше бойлер или газовая колонка";6;36;224;61
"бойлеры для нагрева воды газовые";5;32;685;50
"газовый котел напольный с бойлером";5;34;620;40
"котел газовый с встроенным бойлером";5;35;631;41
"накопительный газовый бойлер для нагрева воды";6;45;100;43
"бойлер газовый накопительный цена";4;33;93;41
"газовый напольный котел с бойлером";5;34;656;42
"напольный газовый котел с бойлером";5;34;661;40
"газовый бойлер аристон 100 литров напольный";6;43;58;49
"бойлер для нагрева воды газовый накопительный";6;45;100;43
"газовый бойлер накопительный для нагрева воды";6;45;100;43
"котел газовый напольный с бойлером";5;34;661;41
"бойлеры газовые для нагрева воды";5;32;685;50
"бойлер 200 литров газовый цена";5;30;169;45
"накопительный газовый бойлер цена";4;33;91;41
"газовый накопительный бойлер для нагрева воды";6;45;100;43
"газовые бойлеры для нагрева воды";5;32;685;50
"газовый котел с встроенным бойлером";5;35;607;40
"двухконтурный газовый котел с бойлером настенный";6;48;135;28
"бойлер своими руками из газового баллона";6;40;76;32
"бойлер газовый косвенного нагрева";4;33;1812;33
"бойлер аристон 200 литров газовый";5;33;165;31
"газовый бойлер косвенного нагрева";4;33;1812;33
"бойлер газовый аристон 200 литров";5;33;165;31
"газовый напольный котел со встроенным бойлером";6;46;169;35
"бойлер косвенного нагрева газовый";4;33;1812;33
"купить бойлер для нагрева воды газовый";6;38;66;34
"бойлер из газового баллона своими руками";6;40;76;32
"газовый бойлер для нагрева воды накопительный";6;45;93;39
"купить газовый бойлер для нагрева воды";6;38;66;34
"газовый бойлер аристон 200 литров";5;33;165;31
"газовый бойлер для нагрева воды купить";6;38;66;34
"одноконтурный газовый котел бойлер косвенного нагрева";6;53;516;39
"котлы газовые с бойлером";4;24;5742;27
"бойлер или газовая колонка";4;26;656;26
"бойлер газовый прямого нагрева";4;30;150;27
"бойлеры газовые накопительные";3;29;717;27
"одноконтурный газовый котел с бойлером";5;38;803;26
"газовый бойлер прямого нагрева";4;30;150;27
"газовая колонка или бойлер";4;26;656;26
"газовые бойлеры накопительные";3;29;717;27
"газовый настенный котел с бойлером";5;34;677;27
"газовые накопительные бойлеры";3;29;717;27
"бойлер прямого нагрева газовый";4;30;150;27
"газовые котлы с бойлером";4;24;5742;27
"бойлеры накопительные газовые";3;29;717;27
"газовый котел одноконтурный с бойлером";5;38;771;26
"накопительные газовые бойлеры";3;29;717;27
"котлы с бойлером газовые";4;24;5742;27
"газовый бойлер аристон 150 литров";5;33;88;26
"газовый котел с бойлером купить";5;31;419;24
"двухконтурный газовый котел с бойлером";5;38;858;24
"газовые бойлеры для нагрева воды цена";6;37;101;25
"газовый двухконтурный котел с бойлером";5;38;858;24
"котел газовый двухконтурный с бойлером";5;38;872;24
"купить газовый котел с бойлером";5;31;432;24
"купить котел газовый с бойлером";5;31;522;25
"газовый котел с бойлером 24 квт";6;31;89;25
"из газового баллона бойлер";4;26;221;25
"газовый котел двухконтурный с бойлером";5;38;858;24
"бойлер и одноконтурный газовый котел";5;36;1018;25
"бойлер из газового баллона";4;26;221;25
"котел настенный газовый с бойлером";5;34;578;24
"бойлер из баллона газового";4;26;221;25
"бойлер газовый аристон 150 литров";5;33;88;26
"бакси газовый бойлер";3;20;320;24
"котлы напольные газовые двухконтурные с бойлером";6;48;127;22
"газовые напольные котлы с бойлером двухконтурные";6;48;127;22
"газовый котел со встроенным бойлером";5;36;362;23
"двухконтурные газовые напольные котлы с бойлером";6;48;127;22
"двухконтурные с бойлером газовые напольные котлы";6;48;127;22
"напольные газовые двухконтурные котлы с бойлером";6;48;127;22
"купить бойлер накопительный газовый";4;35;104;24
"бойлер для газового котла цена";5;30;268;23
"цена бойлер для газового котла";5;30;476;23
"котлы газовые двухконтурные напольные с бойлером";6;48;127;22
"накопительный бойлер газовый купить";4;35;104;24
"настенный газовый котел с бойлером";5;34;604;23
"котлы газовые напольные двухконтурные с бойлером";6;48;127;22
"котел газовый со встроенным бойлером";5;36;378;23
"накопительный газовый бойлер купить";4;35;104;24
"ariston газовый бойлер";3;22;85;22
"брэдфорд вайт газовые бойлеры";4;29;58;20
"бакси бойлер газовый";3;20;330;21
"газовый бойлер 200 литров";4;25;464;21
"одноконтурный газовый котел подключение бойлера";5;47;155;21
"бойлер бакси газовый";3;20;330;21
"котел газовый с бойлером встроенным";5;35;721;20
"бойлер ariston газовый";3;22;85;22
"бойлер газовый бакси";3;20;330;21
"бойлер газовый 200 литров";4;25;464;21
"газовый бойлер бакси";3;20;330;21
"газовый бойлер ariston";3;22;85;22
"бойлер газовый ariston";3;22;85;22
"накопительные бойлеры газовые";3;29;740;20
"бойлер 200 литров газовый";4;25;464;21
"ariston бойлер газовый";3;22;85;22
"газовый котел со встроенным бойлером цена";6;41;50;20
"газовый бойлер проточный";3;24;60;18
"бойлер для горячей воды газовый";5;31;171;18
"газовый накопительный бойлер купить";4;35;101;19
"бойлер газовый для горячей воды";5;31;171;18
"какие бывают бойлеры к газовым котлам";6;37;19;19
"купить газовый накопительный бойлер";4;35;92;18
"купить бойлер газовый накопительный";4;35;108;19
"напольный газовый котел со встроенным бойлером";6;46;95;19
"бойлер накопительный газовый купить";4;35;101;19
"газовый бойлер для горячей воды";5;31;171;18
"купить газовый бойлер накопительный";4;35;108;19
"бойлер газовый накопительный купить";4;35;101;19
"накопительный бойлер для газового котла";5;39;123;18
"газовый бойлер накопительный купить";4;35;101;19
"купить накопительный газовый бойлер";4;35;108;19
"проточный газовый бойлер";3;24;60;18
"газовый котел двухконтурный со встроенным бойлером";6;50;104;15
"бойлер накопительный для газового котла";5;39;116;16
"газовый бойлер или бойлер";4;25;12788;17
"брэдфорд бойлер газовый";3;23;131;15
"газовые котлы вайлант с бойлером";5;32;68;17
"двухконтурный газовый котел со встроенным бойлером";6;50;104;15
"бойлер проточный газовый";3;24;60;18
"газовый бойлер для нагрева воды цены";6;36;101;17
"купить газовый бойлер аристон 150 литров";6;40;26;18
"двухконтурный газовый котел и бойлер электрический";6;50;55;17
"газовый проточный бойлер";3;24;60;18
"газовые бойлеры краснодар";3;25;31;18
"газовый бойлер брэдфорд";3;23;131;15
"газовый бойлер аристон 150 литров купить";6;40;26;18
"бойлер газовый проточный";3;24;60;18
"двухконтурный газовый котел электрический бойлер";5;48;67;15
"бойлер baxi газовый";3;19;326;13
"baxi газовый бойлер";3;19;326;13
"одноконтурный газовый котел со встроенным бойлером";6;50;24;14
"baxi бойлер газовый";3;19;326;13
"газовый бойлер аристон 100 литров настенный";6;43;16;14
"бойлер газовый baxi";3;19;326;13
"купить газовый бойлер в москве";5;30;73;14
"купить бойлер газовый прямого нагрева";5;37;21;14
"газовый бойлер купить в москве";5;30;70;14
"аристон бойлеры газовые";3;23;941;13
"купить бойлер газовый в москве";5;30;73;14
"газовый бойлер в москве купить";5;30;70;14
"газовый бойлер baxi";3;19;326;13
"бойлер газовый купить в москве";5;30;64;14
"бойлер из газовых баллонов";4;26;220;14
"газовый бойлер с рециркуляцией";4;30;82;13
"бойлер газовый 300 литров";4;25;65;12
"газовый бойлер для воды цена";5;28;186;12
"газовый бойлер 120 литров аристон";5;33;19;13
"бойлеры прямого нагрева газовые";4;31;150;12
"бойлер для газового котла косвенного нагрева";6;44;1458;12
"газовые бойлеры прямого нагрева";4;31;150;12
"купить бойлер газовый на 200 литров";6;35;66;13
"газовый бойлер напольный для нагрева воды";6;41;17;13
"газовый бойлер 300 литров";4;25;54;13
"бойлер косвенного нагрева для газового котла";6;44;1458;12
"купить газовый бойлер напольный";4;31;70;13
"газовый напольный бойлер купить";4;31;66;13
"бойлеры газовые прямого нагрева";4;31;150;12
"бойлер 300 литров газовый";4;25;54;13
"купить напольный газовый бойлер";4;31;70;13
"конденсационный газовый котел с бойлером";5;40;41;12
"напольные двухконтурные газовые котлы с бойлером";6;48;91;11
"настенные газовые котлы с бойлером";5;34;604;11
"котлы и бойлеры газовые";4;23;5742;11
"газовые котлы с бойлером настенные";5;34;557;11
"котел газовый бойлер";3;20;5388;11
"двухконтурные напольные газовые котлы с бойлером";6;48;91;11
"бойлеры прямого нагрева газовые независимые";5;43;12;12
"бойлер газовый котел";3;20;5388;11
"газовые котлы и бойлеры";4;23;5742;11
"газовый котел бойлер";3;20;5388;11
"зачем нужен бойлер к газовому котлу";6;35;15;12
"котел бойлер газовый";3;20;5924;11
"напольные газовые котлы двухконтурные с бойлером";6;48;91;11
"котлы газовые и бойлеры";4;23;5742;11
"купить бойлер газовый аристон 150 литров";6;40;15;12
"купить бойлер газовый напольный";4;31;61;11
"напольный газовый бойлер";3;24;872;10
"бойлер напольный газовый";3;24;872;10
"купить бойлер прямого нагрева газовый";5;37;15;11
"бойлер газовый напольный";3;24;872;10
"газовый бойлер для воды";4;23;1033;10
"газовый напольный бойлер";3;24;872;10
"бойлер аристон 200 литров газовый инструкция";6;44;15;11
"напольный бойлер газовый";3;24;1112;10
"бойлер газовый аристон 200 литров инструкция";6;44;15;11
"бойлер для воды газовый";4;23;1033;10
"купить бойлер на 200 литров газовый";6;35;45;11
"газовый бойлер аристон 200 литров инструкция";6;44;15;11
"газовый бойлер напольный";3;24;872;10
"бойлер аристон газовый 200 литров инструкция";6;44;15;11
"купить напольный бойлер газовый";4;31;59;11
"цена газовый котел с бойлером цена";6;34;476;10
"бойлер газовый 200 л";4;20;40;10
"котел газовый двухконтурный с бойлером купить";6;45;63;10
"бойлер косвенного нагрева или газовая колонка";6;45;97;10
"двухконтурный газовый котел с бойлером купить";6;45;63;10
"газовые бойлеры с закрытой камерой сгорания";6;43;77;10
"газовый котел двухконтурный с бойлером купить";6;45;63;10
"как подключить бойлер к газовому котлу";6;38;306;10
"газовая колонка или бойлер косвенного нагрева";6;45;97;10
"купить газовый котел двухконтурный с бойлером";6;45;112;10
"купить двухконтурный газовый котел с бойлером";6;45;63;10
"схема подключения бойлера к газовому котлу";6;42;317;10
"электрический или газовый бойлер";4;32;248;10
"газовый двухконтурный котел с бойлером купить";6;45;63;10
"купить газовый двухконтурный котел с бойлером";6;45;112;10
"купить бойлер для газового котла";5;32;432;10
"газовый бойлер 200 л";4;20;40;10
"газовый бойлер 100 литров цена";5;30;39;10
"бойлер газовый 100 литров цена";5;30;39;10
"газовый бойлер на 200 литров купить";6;35;37;10
"купить газовый бойлер на 200 литров";6;35;37;10
"бойлер 150 литров газовый цена";5;30;20;10
"газовый бойлер прямого нагрева купить";5;37;18;10
"купить газовый бойлер прямого нагрева";5;37;18;10
"бойлер прямого нагрева газовый купить";5;37;18;10
"бойлер газовый прямого нагрева купить";5;37;18;10
"напольный газовый бойлер для нагрева воды";6;41;16;10
"газовый бойлер для нагрева воды напольный";6;41;15;10
"газовый напольный бойлер для нагрева воды";6;41;15;10
"бойлер газовый напольный для нагрева воды";6;41;15;10
"бойлер для нагрева воды напольный газовый";6;41;15;10
"что выбрать газовая колонка или бойлер";6;38;14;10
"газовый одноконтурный котел с бойлером косвенного нагрева";7;57;334;77
"одноконтурный газовый котел с бойлером косвенного нагрева";7;57;333;76
"котел газовый напольный с бойлером косвенного нагрева";7;53;115;40
"напольный газовый котел с бойлером косвенного нагрева";7;53;103;25
"одноконтурный газовый котел и бойлер косвенного нагрева";7;55;333;24
"настенный газовый котел двухконтурный настенный с бойлером";7;58;203;22
"котлы газовые настенные двухконтурные со встроенным бойлером";7;60;32;22
"двухконтурный газовый котел с бойлером косвенного нагрева";7;57;176;21
"как подключить бойлер к двухконтурному газовому котлу";7;53;87;20
"двухконтурный газовый котел или одноконтурный и бойлер";7;54;70;20
"напольный газовый котел двухконтурный со встроенным бойлером";7;60;23;20
"нужен ли бойлер для двухконтурного газового котла";7;49;29;18
"газовый бойлер аристон 200 литров схема подключения";7;51;19;18
"подключение бойлера косвенного нагрева к газовому котлу";7;55;330;17
"газовый котел с бойлером косвенного нагрева купить";7;50;86;17
"купить газовый котел с бойлером косвенного нагрева";7;50;86;17
"котел газовый напольный двухконтурный с бойлером энергонезависимый";7;66;22;17
"бойлер аристон 200 литров газовый схема подключения";7;51;19;17
"купить котел газовый с бойлером косвенного нагрева";7;50;164;16
"как к двухконтурному газовому котлу подключить бойлер";7;53;42;15
"как подключить бойлер к газовому двухконтурному котлу";7;53;42;15
"накопительный бойлер косвенного нагрева для газового котла";7;58;16;15
"газовый настенный котел с бойлером косвенного нагрева";7;53;96;14
"газовые котлы будерус с бойлером косвенного нагрева";7;51;28;13
"газовые котлы с бойлером косвенного нагрева будерус";7;51;28;13
"двухконтурный газовый котел и бойлер косвенного нагрева";7;55;176;12
"купить бойлер косвенного нагрева для газового котла";7;51;167;12
"накопительный бойлер для нагрева воды газовый накопительный";7;59;101;12
"как подключить одноконтурный газовый котел к бойлеру";7;52;27;12
"газовые бойлеры 200 литров нагрева воды цена";7;44;18;11
"купить газовый накопительный бойлер для воды 200л";7;49;13;11
"напольный газовый котел со встроенным бойлером цена";7;51;12;11
"подключение к газовому котлу бойлера косвенного нагрева";7;55;349;10
"как подключить косвенный бойлер к газовому котлу";7;48;88;10
"настенные двухконтурные газовые котлы со встроенным бойлером";7;60;26;10
"накопительные бойлеры для нагрева воды газовые цена";7;51;18;10
"купить одноконтурный газовый котел с бойлером косвенного нагрева";8;64;87;82
"схема подключения напольного газового котла и газового бойлера";8;62;45;36
"что лучше бойлер косвенного нагрева или газовая колонка";8;55;36;29
"что лучше газовая колонка или бойлер косвенного нагрева";8;55;36;29
"схема подключения газового котла и бойлера косвенного нагрева";8;61;133;27
"газовый котел и бойлер косвенного нагрева схема подключения";8;59;139;21
"одноконтурный газовый котел с бойлером косвенного нагрева цена";8;62;23;21
"подключение бойлера косвенного нагрева к газовому двухконтурному котлу";8;70;58;20
"из газового баллона своими руками бойлер косвенного нагрева";8;59;22;20
"подключение бойлера косвенного нагрева к двухконтурному газовому котлу";8;70;61;19
"бойлер косвенного нагрева из газового баллона своими руками";8;59;24;18
"бойлер косвенного нагрева своими руками из газового баллона";8;59;24;18
"схема обвязки газового котла с бойлером косвенного нагрева";8;58;43;16
"купить газовый одноконтурный котел с бойлером косвенного нагрева";8;64;27;16
"одноконтурный газовый котел с бойлером косвенного нагрева купить";8;64;27;16
"газовый котел с возможностью подключения бойлера косвенного нагрева";8;67;26;14
