"Ключевое слово";"Слов";"Символов";"Частотность Весь мир";"""!Частотность !Весь !мир"""
"инфракрасное отопление";2;22;11119;1777
"потолочное отопление инфракрасное";3;33;340;65
"купить инфракрасное отопление";3;29;737;109
"инфракрасное отопление цена";3;27;974;125
"инфракрасное отопление купить";3;29;737;109
"инфракрасное пленочное отопление";3;32;404;111
"отопление инфракрасное отопление купить в";5;41;652;76
"инфракрасные панели отопления";3;29;1002;243
"пленочное инфракрасное отопление";3;32;404;111
"инфракрасное отопление дома отзывы форум";5;40;145;141
"инфракрасное отопление пленочное";3;32;404;111
"инфракрасное отопление дома";3;27;1685;439
"инфракрасное отопление дома цены";4;32;304;141
"инфракрасное отопление дома отзывы";4;34;366;77
"инфракрасное отопление отзывы";3;29;978;125
"отопление инфракрасными обогревателями";3;38;1218;642
"инфракрасное отопление потолочное";3;33;340;65
"инфракрасные батареи отопления";3;30;116;36
"отопление инфракрасное отопление купить";4;39;568;42
"инфракрасное отопление частного дома";4;36;245;50
"инфракрасное гипсокартонное отопление цена";4;42;46;42
"промышленное инфракрасное отопление";3;35;113;45
"панель отопления инфракрасная";3;29;807;39
"плэн инфракрасное отопление";3;27;191;54
"инфракрасная панель отопления";3;29;1002;49
"отопление инфракрасное частного дома";4;36;211;52
"инфракрасные панели отопления цена";4;34;111;43
"потолочное инфракрасное отопление";3;33;340;65
"инфракрасное отопление плэн";3;27;191;54
"инфракрасное отопление расход электроэнергии";4;44;56;40
"отопление частного дома инфракрасное";4;36;250;51
"инфракрасное потолочное отопление";3;33;340;65
"батареи отопления инфракрасные";3;30;116;36
"потолочное отопление инфракрасное отзывы";4;40;44;26
"инфракрасный конвектор отопления";3;32;214;27
"отопление инфракрасное плэн цена";4;32;57;31
"инфракрасное отопление в тюмени отопление";5;41;55;26
"отопление инфракрасными обогревателями отзывы";4;45;89;29
"потолочное инфракрасное отопление отзывы";4;40;44;26
"инфракрасное отопление отзывы владельцев";4;40;81;35
"вредно ли инфракрасное отопление для человека";6;45;34;30
"инфракрасный теплый пол как основное отопление отзывы";7;53;37;32
"потолочные инфракрасные панели отопления";4;40;60;29
"системы отопления инфракрасные";3;30;406;35
"инфракрасные панели отопления отзывы";4;36;70;33
"отзывы инфракрасное потолочное отопление";4;40;44;26
"инфракрасные конвекторы отопления электрические цена";5;52;37;32
"инфракрасное отопление вред для здоровья";5;40;97;36
"отопление инфракрасной пленкой отзывы";4;37;42;26
"пленка инфракрасная для отопления";4;33;269;22
"отопление теплицы инфракрасным обогревателем";4;44;51;24
"отопление газовое инфракрасное";3;30;289;25
"инфракрасный теплый пол отзывы как основное отопление";7;53;32;24
"отзывы отопление инфракрасными обогревателями";4;45;64;24
"инфракрасные панели отопления купить";4;36;157;23
"инфракрасное отопление зебра отзывы";4;35;28;26
"инфракрасное отопление газовое";3;30;289;25
"газовое инфракрасное отопление";3;30;289;25
"инфракрасное отопление плэн цена";4;32;51;24
"инфракрасное потолочное отопление отзывы";4;40;41;26
"инфракрасное газовое отопление";3;30;289;25
"инфракрасное отопление цена в ростове на дону";7;45;26;24
"отопление инфракрасное газовое";3;30;289;25
"инфракрасное отопление потолочное отзывы";4;40;41;26
"плэн инфракрасное отопление цена";4;32;50;22
"инфракрасное отопление гаража";3;29;105;18
"инфракрасное отопление зебра";3;28;89;19
"цена инфракрасное отопление плэн";4;32;40;20
"зебра инфракрасное отопление";3;28;89;19
"зебра инфракрасное отопление отзывы";4;35;22;20
"какие инфракрасные обогреватели выбрать в качестве основного отопления";8;70;19;19
"инфракрасная пленка для отопления";4;33;273;21
"инфракрасные системы отопления по энергосберегающей технологии";6;62;30;20
"инфракрасные системы отопления";3;30;352;20
"отопление дома инфракрасными обогревателями";4;43;154;19
"инфракрасное отопление отзывы владельцев форум";5;46;22;22
"купить инфракрасные панели отопления";4;36;153;21
"инфракрасное отопление в тюмени купить";5;38;25;19
"расчет инфракрасного отопления";3;30;145;20
"отзывы инфракрасное отопление зебра";4;35;24;22
"инфракрасное потолочное отопление цена";4;38;57;18
"инфракрасное пленочное отопление цена";4;37;40;17
"инфракрасные газовые горелки для отопления";5;42;71;17
"что такое инфракрасное отопление";4;32;11428;17
"газовые инфракрасные горелки для отопления";5;42;71;17
"инфракрасные конвекторы отопления";3;33;214;17
"инфракрасное отопление пленочное цена";4;37;40;17
"потолочное отопление инфракрасное цена";4;38;56;18
"конвекторы отопления инфракрасные";3;33;214;17
"расчет инфракрасного отопления калькулятор";4;42;44;18
"отзывы отопление инфракрасными обогревателями отзывы";5;52;72;17
"потолочное инфракрасное отопление цена";4;38;56;18
"купить инфракрасное пленочное отопление";4;39;45;18
"инфракрасные панели водяные панели отопления";5;44;46;17
"инфракрасное отопление дома вред для здоровья";6;45;18;18
"инфракрасное отопление потолочное цена";4;38;57;18
"пленочное инфракрасное отопление цена";4;37;36;17
"инфракрасное отопление дома потребляемая энергия";5;48;15;15
"инфракрасное водяное отопление";3;30;96;15
"инфракрасное отопление краснодар";3;32;53;16
"инфракрасное отопление водяное";3;30;96;15
"система инфракрасного отопления";3;31;406;15
"калькулятор расчет инфракрасного отопления";4;42;36;15
"инфракрасное отопление пола";3;27;328;16
"инфракрасная система отопления частного дома";5;44;31;16
"инфракрасные радиаторы отопления";3;32;111;16
"отопление инфракрасными обогревателями дома";4;43;111;15
"инфракрасное отопление что такое";4;32;12293;16
"инфракрасное отопление дома цена";4;32;304;16
"водяное инфракрасное отопление";3;30;96;15
"радиаторы отопления инфракрасные";3;32;111;16
"инфракрасные панели отопления супермамки";4;40;18;17
"отопление инфракрасное для дома";4;31;1387;14
"система отопления инфракрасная";3;30;406;12
"инфракрасное отопление производственных помещений";4;49;61;13
"отзывы по инфракрасному отоплению";4;33;1008;13
"инфракрасное пленочное отопление купить";4;39;43;13
"конвектор отопления инфракрасный";3;32;181;13
"инфракрасное отопление отзывы владельцев цена";5;45;19;13
"инфракрасное пленочное отопление частного дома отзывы";6;53;17;14
"отопление пола инфракрасное";3;27;288;13
"инфракрасное отопление для дома";4;31;1782;13
"отопление водяное инфракрасное";3;30;105;13
"инфракрасное отопление дома отзывы и цены";6;41;25;14
"инфракрасное отопление цена за кв м";6;35;16;14
"отопление дома инфракрасными обогревателями отзывы";5;50;40;13
"инфракрасное отопление в доме";4;29;1782;13
"стоимость инфракрасное отопление";3;32;62;14
"инфракрасная система отопления";3;30;352;12
"купить инфракрасное отопление для дома";5;38;47;12
"отзывы о пленочном инфракрасном отоплении";5;41;48;12
"инфракрасное отопление для дачи";4;31;87;12
"инфракрасные панели отопления потолочные";4;40;47;12
"инфракрасный котел отопления";3;28;66;12
"инфракрасное отопление для дома купить";5;38;47;12
"инфракрасное отопление на потолок";4;33;160;12
"инфракрасное отопление стоимость";3;32;70;12
"инфракрасный пол как основное отопление";5;39;100;12
"инфракрасное отопление загородного дома";4;39;61;12
"пленка инфракрасного отопления";3;30;269;12
"вред инфракрасного отопления";3;28;113;12
"инфракрасные потолочные панели отопления";4;40;47;12
"монтаж инфракрасного отопления";3;30;98;12
"система отопления инфракрасного";3;31;292;12
"пленочное инфракрасное отопление купить";4;39;41;12
"инфракрасная батарея отопления";3;30;116;10
"инфракрасные панели для отопления";4;33;1005;10
"инфракрасное отопление в ростове на дону цена";7;45;22;11
"отопление инфракрасными панелями";3;32;1002;10
"отопление инфракрасные";2;22;11119;10
"отопление инфракрасное электрическое";3;36;218;10
"отопление гаража инфракрасное";3;29;72;11
"инфракрасное отопление что это";4;30;11500;10
"инфракрасное отопление деревянного дома";4;39;32;11
"инфракрасные отопление";2;22;11119;10
"инфракрасное отопление в гараже";4;31;115;11
"инфракрасное отопление своими руками";4;36;32;11
"инфракрасное отопление электрическое";3;36;218;10
"барнаул инфракрасное отопление";3;30;24;11
"отопление частного дома инфракрасными обогревателями отзывы";6;59;22;12
"инфракрасное отопление в челябинске";4;35;107;10
"инфракрасные панели водяные отопления";4;37;50;10
"отзывы инфракрасное пленочное отопление";4;39;45;10
"инфракрасное отопление пленочное отзывы";4;39;45;10
"пленочное отопление инфракрасное отзывы";4;39;45;10
"инфракрасное пленочное отопление на потолок";5;43;35;10
"пленочное инфракрасное отопление на потолок";5;43;35;10
"инфракрасное отопление барнаул";3;30;27;10
"инфракрасная газовая горелка в котел отопления";6;46;24;10
"отопление инфракрасное краснодар";3;32;20;10
"краснодар инфракрасное отопление";3;32;20;10
