"Ключевое слово";"Слов";"Символов";"Частотность Весь мир";"""!Частотность !Весь !мир"""
"отопление без газа и электричества";5;34;872;33
"отопление частного дома без газа и электричества";7;48;578;197
"отопление дома без газа и электричества";6;39;745;109
"отопление в гараже водяное без электричества";6;44;37;37
"альтернативное отопление частного дома без газа и электричества";8;63;290;268
"газовый котел для отопления частного дома без электричества";8;59;36;24
"газовый котел без электричества для отопления частного дома";8;59;36;24
"самодельное отопление в доме от электричества без котла";8;55;20;20
"автономное отопление в частном доме без газа и электричества";9;60;27;15
"видео альтернативное отопление частного дома без газа и электричества";9;69;11;11
"альтернативное отопление частного дома без газа и электричества видео";9;69;11;11
"как согреть квартиру без отопления и электричества";7;50;10;10
