"Ключевое слово";"Слов";"Символов";"Частотность Весь мир";"""!Частотность !Весь !мир"""
"расчет насоса";2;13;6232;51
"расчет насоса для теплого пола калькулятор";6;42;100;29
"расчет циркуляционного насоса для системы отопления онлайн";7;58;76;32
"расчет циркуляционного насоса для системы отопления";6;51;549;168
"онлайн расчет циркуляционного насоса для системы отопления";7;58;76;32
"расчет мощности насоса";3;22;664;36
"расчет производительности насоса";3;32;270;30
"выбор циркуляционного насоса для системы отопления расчет насоса";8;64;99;88
"расчет центробежного насоса";3;27;396;44
"расчет насоса для теплого пола";5;30;325;78
"расчет мощности циркуляционного насоса для отопления калькулятор";7;64;41;36
"расчет насоса для системы отопления";5;35;729;88
"как подобрать циркуляционный насос для системы отопления расчет";8;63;111;87
"расчет напора насоса";3;20;378;31
"расчет циркуляционного насоса";3;29;1105;65
"расчет циркуляционного насоса для системы отопления расчет насоса";8;65;540;123
"как подобрать циркуляционный насос для теплого пола расчет";8;58;26;26
"расчет кавитационный запас насоса";4;33;83;19
"кавитационный запас насоса расчет";4;33;86;20
"расчет теплового насоса";3;23;322;23
"расчет циркуляционного насоса онлайн";4;36;144;19
"расчет насоса отопления";3;23;1212;22
"расчет насоса для отопления для дома";6;36;89;19
"онлайн расчет напора насоса";4;27;52;24
"расчет мощности насоса для отопления";5;36;150;23
"расчет онлайн напора насоса";4;27;52;24
"расчет для насоса отопления";4;27;1045;20
"расчет насоса кавитационного запаса насоса";5;42;94;24
"расчет напора насоса онлайн";4;27;52;24
"онлайн расчет циркуляционного насоса";4;36;144;19
"расчет насоса для отопления";4;27;1325;23
"расчет насоса для отопления калькулятор";5;39;194;24
"расчет насоса для отопления калькулятор онлайн";6;46;33;19
"расчет напора насоса отопления";4;30;46;14
"расчет скважинного насоса";3;25;141;14
"расчет насоса для скважины";4;26;112;15
"насос циркуляционный расчет мощности";4;36;116;14
"расчет циркуляционного насоса для системы отопления частного дома";8;65;23;15
"расчет циркуляционного насоса для теплого пола";6;46;92;14
"расчет насоса для системы отопления калькулятор";6;47;26;17
"расчет центробежного насоса пример";4;34;38;15
"расчет насоса для отопления онлайн калькулятор";6;46;22;16
"расчет циркуляционного насоса для теплого пола калькулятор";7;58;16;15
"расчет циркуляционного напора насоса";4;36;76;18
"калькулятор расчет скважинного насоса";4;37;30;16
"циркуляционный насос расчет мощности";4;36;114;14
"расчет агрегата для теплового насоса";5;36;17;16
"расчет напора насоса циркуляционного";4;36;76;18
"онлайн расчет насоса для отопления калькулятор";6;46;20;14
"онлайн расчет кавитационного запаса насоса";5;42;23;12
"кпд насоса расчет";3;17;98;12
"расчет напора насоса для водоснабжения";5;38;19;13
"расчет кпд насоса";3;17;98;12
"как подобрать циркуляционный насос для системы отопления онлайн расчет";9;70;13;13
"расчет мощности циркуляционного насоса отопления";5;48;75;12
"расчет насоса кпд";3;17;93;13
"расчет подачи бурового насоса";4;29;18;13
"расчет кавитационный запас насоса онлайн";5;40;25;13
"расчет насос центробежный";3;25;441;12
"расчет насоса отопления частного дома калькулятор";6;49;14;14
"формула расчета кпд насоса";4;26;39;13
"насоса кпд расчет";3;17;98;12
"кавитационный запас насоса расчет онлайн";5;40;24;13
"расчет производительности циркуляционного насоса на отопление";6;61;15;14
"расчет напора насоса для теплого пола калькулятор";7;49;14;12
"расчет мощности теплового насоса";4;32;28;10
"расчет насоса циркуляционного онлайн";4;36;94;10
"расчет скважинного насоса калькулятор";4;37;22;11
"расчет кавитационного запаса насоса";4;35;83;10
"расчет насосов для отопления";4;28;1325;10
"расчет кпд насоса формула";4;25;39;10
"расчет циркуляционного насоса для отопления";5;43;728;11
"как подобрать циркуляционный насос для системы отопления расчет онлайн";9;70;12;11
"расчет теплового насоса для отопления дома";6;42;37;11
"расчет мощности насоса отопления";4;32;137;10
"расчет насоса циркуляционного для отопления";5;43;728;11
"расчет струйного насоса";3;23;70;11
"расчет напора циркуляционного насоса";4;36;60;10
"расчет кавитационного запаса насоса онлайн";5;42;25;11
"циркуляционный насос расчет";3;27;1149;11
"расчет мощности насоса центробежного";4;36;19;10
"расчет насоса для водоснабжения частного дома";6;45;19;10
"расчет насоса для мойки";4;23;10;10
