"Ключевое слово";"Слов";"Символов";"Частотность Весь мир";"""!Частотность !Весь !мир"""
"чердак кровать детская";3;22;15080;2070
"кровать чердак детская купить";4;29;3275;133
"кровать чердак детская с рабочей зоной";6;38;1103;150
"кровать чердак детская мебель";4;29;851;184
"кровать детская чердак со столом";5;32;777;142
"мебель детская кровать чердак";4;29;832;178
"детские кровати чердаки цены";4;28;470;138
"кровати чердаки детские";3;23;14625;450
"детская мебель кровать чердак";4;29;851;184
"купить кровать чердак детскую";4;29;3197;420
"детская кровать чердак с рабочей зоной";6;38;1103;150
"детская кровать чердак";3;22;14625;2029
"детские кровати чердаки";3;23;14625;450
"детская кровать чердак со столом";5;32;768;141
"купить детскую кровать чердак";4;29;3197;420
"кровать чердак детская";3;22;14625;2029
"детская кровать чердак купить";4;29;3275;133
"детская кровать чердак с горкой";5;31;169;80
"икеа кровать чердак детская";4;27;180;88
"детская кровать чердак недорого";4;31;657;100
"детская кровать чердак икеа";4;27;180;88
"икеа детская кровать чердак";4;27;180;88
"детские кровати чердак";3;22;14625;83
"детские кровати чердаки с рабочей зоной";6;39;1103;109
"детская комната с кроватью чердаком";5;35;393;99
"детская кровать чердак купить в москве";6;38;324;107
"кровать чердак детская икеа";4;27;180;88
"купить детская кровать чердак";4;29;3197;129
"детская кровать чердак купить недорого";5;38;417;109
"икеа кровать детская чердак";4;27;188;84
"кровать чердак детская купить в москве";6;38;324;107
"кровать чердак детская со столом";5;32;890;133
"кровать чердак с горкой детская";5;31;160;78
"детская чердак кровать легенда";4;30;202;54
"детская кровать чердак низкая";4;29;178;62
"кровать чердак с диваном детская";5;32;374;62
"низкая кровать чердак детская";4;29;173;60
"кровать детская чердак с диваном";5;32;374;62
"детский кровать чердак";3;22;14625;58
"кровать чердак детская своими руками";5;36;188;69
"кровать чердак детская с диваном";5;32;374;62
"детские кровати чердаки для мальчиков";5;37;409;67
"детская кровать чердак с диваном";5;32;360;62
"дизайн детской с кроватью чердаком";5;34;164;70
"кровать детская чердак своими руками";5;36;188;69
"кровать чердак детский";3;22;14625;58
"детская кровать чердак своими руками";5;36;180;64
"кровать чердак детская с горкой";5;31;160;78
"детская кровать чердак со столом купить";6;39;176;53
"детские кровать чердак с рабочей зоной";6;38;1103;42
"кровать чердак легенда детская";4;30;166;44
"кровать чердак детская каталог";4;30;100;47
"детская кровать чердак легенда";4;30;166;44
"кровать детская чердак легенда";4;30;166;44
"кровать чердак из дерева детская";5;32;149;43
"фото детская кровать чердак";4;27;506;50
"детская кровать чердак каталог";4;30;100;47
"кровать чердак детская фото";4;27;502;49
"кровать чердак детская легенда";4;30;166;44
"чердак кровать детская фото";4;27;506;50
"детская кровать чердак фото";4;27;502;49
"детская кровать чердак из дерева";5;32;150;43
"детская для девочки кровать чердак";5;34;391;48
"детские кровати чердаки спб";4;27;396;52
"легенда детская кровать чердак";4;30;162;42
"где купить детскую кровать чердак";5;33;58;36
"детская кровать чердак малыш";4;28;170;36
"кровать чердак детская деревянная";4;33;69;40
"детская кровать чердак астра";4;28;135;36
"детская кровать чердак деревянная";4;33;69;40
"детские кровати чердаки с диваном внизу";6;39;119;36
"купить кровать чердак детскую мебель";5;36;94;40
"детская деревянная кровать чердак";4;33;69;40
"деревянная кровать чердак детская";4;33;69;40
"кровать чердак детская из массива дерева";6;40;66;39
"детские кровати чердаки на заказ";5;32;192;41
"купить детскую мебель кровать чердак";5;36;94;40
"детская кровать астра чердак";4;28;135;36
"деревянная детская кровать чердак";4;33;69;40
"детские кровать чердак";3;22;14625;41
"купить детский уголок с кроватью чердаком";6;41;46;35
"детская стенка кровать чердак";4;29;79;34
"детская кровать чердак мини";4;27;93;34
"детская чердак кровать мини";4;27;93;34
"кровать чердак детская мини";4;27;93;34
"детская мини кровать чердак";4;27;93;34
"детская стенка чердак кровать";4;29;79;34
"детская чердак кровать со шкафом";5;32;639;34
"кровать детская мини чердак";4;27;93;34
"детская кровать чердак купить в спб";6;35;197;34
"детская кровать мини чердак";4;27;93;34
"детские кровати чердаки под заказ";5;33;43;35
"кровать детская чердак для девочки";5;34;452;34
"кровать детская чердак мини";4;27;93;34
"кровать детская чердак купить в спб";6;35;197;34
"детский уголок с кроватью чердаком купить";6;41;46;35
"магазины детских кроватей чердаков";4;34;242;33
"детские кровати чердаки для девочек";5;35;449;25
"кровать детская с чердаком";4;26;15351;25
"стенка детская кровать чердак";4;29;70;31
"детская кровать с чердаком";4;26;15351;25
"кровать чердак детская на заказ";5;31;191;26
"детские кровати для девочек чердаки";5;35;449;25
"кровать чердак со шкафом детская";5;32;536;31
"кровать детская чердак авито";4;28;248;26
"кровать чердак детская со шкафом";5;32;536;31
"кровать чердак с детской кроваткой";5;34;144;26
"мини детская кровать чердак";4;27;78;32
"кровать детская чердак со шкафом";5;32;536;31
"кровать с чердаком детская";4;26;15351;25
"купить детскую кровать чердак недорого";5;38;416;31
"детская кровать чердак со шкафом";5;32;530;32
"детская кровать чердак для девочки";5;34;449;25
"детские кровати чердаки от производителя";5;40;97;24
"кровать детская для девочки чердак";5;34;452;24
"кровать чердак с кроваткой детской";5;34;128;25
"кровати чердаки детские купить недорого";5;39;385;24
"кровать чердак детская с рабочей";5;32;1143;24
"детская кровать из дерева чердак";5;32;127;24
"кровать чердак детская массив";4;29;207;25
"детский уголок с кроватью чердаком";5;34;115;25
"детская кровать чердак массив";4;29;207;25
"кровать чердак детская для девочки";5;34;452;24
"купить детские кровати чердаки недорого";5;39;416;25
"кровать детская чердак массив";4;29;207;25
"детская кровать чердак на заказ";5;31;192;24
"кровать с детской кроваткой чердак";5;34;128;25
"детские кровати чердаки купить недорого";5;39;417;25
"детские чердаки кровати от производителя";5;40;97;24
"кровать чердак двухъярусная детская";4;35;94;20
"кровать чердак мини детская";4;27;107;20
"детская кровать м85 чердак";4;26;31;21
"кровать мини чердак детская";4;27;107;20
"кровать чердак из массива детская";5;33;211;20
"детская двухъярусная кровать чердак";4;35;94;20
"детская с кроватью чердаком";4;27;15351;21
"детская кровать чердак м85";4;26;31;21
"кровать двухъярусная детская чердак";4;35;93;21
"мини чердак детская кровать";4;27;107;20
"кровать чердак детская из дерева";5;32;127;22
"цена чердак кровать детская";4;27;395;21
"двухъярусная кровать чердак детская";4;35;94;20
"кровать чердак детская астра 5";5;30;35;21
"на заказ детская кровать чердак";5;31;152;22
"детская кровать двухъярусная чердак";4;35;94;20
"авито детская кровать чердак";4;28;192;18
"детская кровать чердак трансформер";4;34;37;19
"кровать чердак белая детская";4;28;51;19
"детская кровать трансформер чердак";4;34;37;19
"белая детская кровать чердак";4;28;46;19
"авито кровать чердак детская";4;28;192;18
"детская кровать чердак двухъярусная";4;35;110;19
"детская кровать чердак белая";4;28;51;19
"кровать детская чердак сказка";4;29;62;19
"кровать чердак трансформер детская";4;34;37;19
"детские кровати чердаки купить";4;30;3275;19
"детская кровать мийа чердак";4;27;98;19
"мебель детская с кроватью чердаком";5;34;706;18
"кровать чердак детская белая";4;28;51;19
"кровати чердаки детские купить";4;30;3275;19
"авито кровать детская чердак";4;28;192;18
"кровать чердак мийа детская";4;27;67;17
"кровать чердак детская двухъярусная";4;35;105;17
"москва детская кровать чердак";4;29;412;17
"кровать детская двухъярусная чердак";4;35;105;17
"детская кровать чердак авито";4;28;184;17
"детская мийа кровать чердак";4;27;68;17
"кровать детская чердак цена";4;27;470;17
"екатеринбург детские кровати чердаки";4;36;236;17
"кровать чердак детская москва";4;29;429;17
"кровать чердак детская авито";4;28;184;17
"детская кровать чердак цена";4;27;470;17
"кровать чердак детская цена";4;27;470;17
"двухъярусная детская кровать чердак";4;35;105;17
"детская кровать чердак москва";4;29;429;17
"купить детские кровати чердаки";4;30;3197;17
"детская кровать чердак мийа";4;27;67;17
"детские двухъярусные кровати чердак";4;35;94;15
"кровать чердак детская м 85";5;27;30;16
"детская кровать сказка чердак";4;29;60;16
"детская кровать чердак с рабочей";5;32;1196;15
"детская кровать чердак корсар";4;29;36;16
"кровать двухъярусная чердак детская";4;35;99;15
"кровати мини чердаки детские";4;28;111;16
"кровать чердак корсар детская";4;29;36;16
"кровать чердак детская сказка";4;29;60;16
"кровать трансформер чердак детская";4;34;36;16
"кровать чердак астра 5 детская";5;30;30;17
"детские мини кровати чердаки";4;28;107;16
"отзывы детская кровать чердак";4;29;119;15
"детская кровать чердак сказка";4;29;60;16
"детская кровать чердак астра 5";5;30;30;17
"двухъярусные детские кровати чердак";4;35;94;15
"кровать чердак спб детская";4;26;396;13
"детская кровать оранжевая чердак";4;32;24;14
"детская кровать чердак отзывы";4;29;115;14
"цена кровать чердак детская";4;27;463;13
"детские кровати мини чердаки";4;28;93;14
"кровать чердак детская спб";4;26;396;13
"кровать чердак детский купить";4;29;3275;14
"детские кровати чердаки мини";4;28;93;14
"кровать детская чердак екатеринбург";4;35;236;14
"детская кровать чердак оранжевая";4;32;24;14
"детская сказка кровать чердак";4;29;59;15
"детский чердак кровать купить";4;29;3275;14
"цена детская кровать чердак";4;27;463;13
"кровать чердак детская отзывы";4;29;115;14
"детская кровать белая чердак";4;28;60;15
"детская кровать чердак спб";4;26;396;13
"детский кровать чердак купить";4;29;3316;12
"детская кровать чердак м 85";5;27;26;13
"кровать деревянная детская чердак";4;33;40;13
"кровать чердак м 85 детская";5;27;25;13
"дельфин детская кровать чердак";4;30;28;13
"чердак кровать детская м 85";5;27;22;13
"кровать чердак детская из массива";5;33;179;13
"детские кровати чердаки невысокие";4;33;29;13
"кровать чердак деревянная детская";4;33;40;13
"детская кровать чердак мийа венге";5;33;27;13
"детская кровать чердак из массива";5;33;180;13
"детские кровати чердаки белые";4;29;65;13
"детская кровать чердак хабаровск";4;32;23;13
"кровать деревянная чердак детская";4;33;40;13
"кровать детская чердак спб";4;26;396;13
"кровати чердаки детские из массива";5;34;211;12
"фото детской кровати чердак";4;27;506;10
"кровать детская чердак соня";4;27;25;11
"детские кровати с чердаком";4;26;15351;11
"детская кровать чердак 160х80";4;29;24;11
"детские кровати чердаки в краснодаре";5;36;80;11
"детская карлсон кровать чердак";4;30;22;11
"детская кровать чердак б у";5;26;124;12
"купить кровать чердак детский";4;29;2971;11
"детская розовая кровать чердак";4;30;34;12
"детские кровати чердаки модульные";4;33;64;11
"кровать чердак детская б у";5;26;133;12
"детская кровать чердак для школьника";5;36;36;12
"карлсон детская кровать чердак";4;30;22;11
"кровать детская 160х80 чердак";4;29;33;12
"кровати чердаки детские из дерева";5;33;142;12
"кровати чердаки детские цена";4;28;456;10
"детские кровати чердаки челябинск";4;33;34;10
"детская кровать карлсон чердак";4;30;28;10
"детская кровать чердак бамбини";4;30;28;10
"детская кровать чердак карлсон";4;30;28;10
"кровать чердак детская бамбини";4;30;28;10
"кровать чердак детская карлсон";4;30;28;10
"кровать чердак детская оранжевая";4;32;18;10
"кровать чердак детская маугли";4;29;15;10
"quot детские кровати чердаки quot";5;33;12;10
"детская кровать чердак купить в краснодаре";6;42;59;33
"детские кровати чердаки от 5 лет";6;32;93;32
"купить детскую кровать чердак для девочек";6;41;56;29
"детская кровать чердак с игровой зоной";6;38;151;28
"кровать чердак детская с игровой зоной";6;38;151;28
"кровать чердак детская хорошего качества купить";6;47;30;28
"кровать чердак внизу с детской кроваткой";6;40;48;27
"детская кровать от 3 лет чердак";6;31;212;26
"детская кровать чердак от 3 лет";6;31;212;26
"кровать детская от 3 лет чердак";6;31;212;26
"кровать чердак детская от 3 лет";6;31;212;26
"купить детские кровать чердак от производителя";6;46;30;26
"детская кровать чердак из массива дерева";6;40;53;25
"кровать чердак детская купить в барнауле";6;40;25;25
"купить в москве детскую кровать чердак";6;38;332;24
"кровать чердак детская купить в краснодаре";6;42;57;24
"мебель для детской комнаты кровать чердак";6;41;49;23
"детская кровать чердак для самых маленьких";6;42;25;21
"детская кровать чердак купить в рязани";6;38;21;21
"кровать чердак с выдвижным столом детская";6;41;34;17
"детская кровать чердак в рязани купить";6;38;28;17
"дизайн детской комнаты с кроватью чердаком";6;42;54;16
"дизайн комнаты с детской кроватью чердаком";6;42;54;16
"детская мебель ярофф кровать чердак малыш";6;41;20;15
"детская кровать чердак с диваном внизу";6;38;119;14
"кровать чердак детская с выдвижным столом";6;41;33;14
"детская кровать купить чердак в екатеринбурге";6;45;159;13
"детская мебель кровать чердак для девочки";6;41;31;13
"мебель детская для девочки кровать чердак";6;41;31;13
"детская кровать чердак с горкой купить";6;38;27;13
"купить в воронеже детскую кровать чердак";6;40;18;13
"детская кровать чердак с кроватью внизу";6;39;328;12
"детские кровати от 3 лет чердаки";6;32;212;12
"детские кровати чердаки от 3 лет";6;32;212;12
"кровать чердак с детской кроваткой внизу";6;40;52;12
"детская кровать чердак купить в липецке";6;39;46;12
"кровать чердак с горкой детская купить";6;38;28;12
"детская кровать чердак с выдвижным столом";6;41;27;12
"детскую кровать чердак купить в екатеринбурге";6;45;163;11
"кровать чердак детская со шкафом внизу";6;38;18;11
"детская с диваном и кроватью чердаком";6;37;358;10
"детская с кроватью чердаком и диваном";6;37;358;10
"купить в спб детскую кровать чердак";6;35;197;10
"купить детскую кровать чердак в спб";6;35;197;10
"купить кровать чердак детскую в спб";6;35;197;10
"купить кровать чердак детскую в екатеринбурге";6;45;159;10
"купить в екатеринбурге детскую кровать чердак";6;45;151;10
"купить в краснодаре детскую кровать чердак";6;42;54;10
"детские кровати чердаки для двоих детей";6;39;34;10
"детские чердаки кровати для двоих детей";6;39;34;10
"детская кровать чердак со столом и шкафом";7;41;452;222
"детская кровать чердак со шкафом и столом";7;41;452;222
"детская кровать чердак с рабочей зоной купить";7;45;274;149
"купить детскую кровать чердак в интернет магазине";7;49;125;108
"купить детская кровать чердак с рабочей зоной";7;45;224;59
"купить детскую кровать чердак в москве недорого";7;47;86;35
"купить детскую кровать чердак недорого в москве";7;47;86;35
"детская кровать чердак купить недорого в спб";7;44;51;32
"детская кровать чердак от 3 лет купить";7;38;63;31
"детская кровать легенда чердак купить в москве";7;46;35;29
"детская мебель кровать чердак с рабочей зоной";7;45;134;28
"детская кровать чердак с игровой зоной внизу";7;44;45;25
"детская кровать чердак купить в екатеринбурге недорого";7;54;39;25
"мебель детская кровать чердак с рабочей зоной";7;45;124;21
"кровать чердак детская 160х80 с 3 лет";7;37;23;19
"купить детскую кровать чердак с рабочей зоной";7;45;269;18
"детская кровать чердак с диваном внизу купить";7;45;24;15
"купить кровать чердак детскую в екатеринбурге недорого";7;54;108;13
"детская кровать чердак купить недорого в москве";7;47;85;13
"детская кровать чердак недорого купить в москве";7;47;85;13
"детская кровать чердак купить в москве недорого";7;47;82;13
"детская кровать чердак с рабочей зоной недорого";7;47;56;12
"детские кровати чердаки с рабочей зоной для мальчика";8;52;173;71
"детские кровати чердаки с рабочей зоной для девочек";8;51;91;64
"детская кровать чердак с рабочим местом купить спб";8;50;37;34
"детская кровать чердак для девочки от 5 лет";8;43;26;24
"кровать детская чердак со столом и шкафом фото";8;46;135;23
"кровать чердак детская со столом и шкафом фото";8;46;127;21
"детская кровать чердак со столом и шкафом фото";8;46;113;20
"детская кровать чердак со шкафом и столом фото";8;46;113;20
"фото детская кровать чердак со столом и шкафом";8;46;111;14
"детская кровать чердак купить в ростове на дону";8;47;42;13
