"Ключевое слово";"Слов";"Символов";"Частотность Весь мир";"""!Частотность !Весь !мир"""
"купить детскую кровать чердак с рабочей зоной недорого";8;54;41;13
"детская кровать чердак своими руками чертежи и схемы";8;52;18;11
"детская мебель для мальчика кровать чердак с рабочей зоной";9;58;56;51
"детская кровать чердак на заказ по индивидуальным размерам недорого";9;67;14;14
"детская кровать чердак купить б у в екатеринбурге недорого";9;58;20;13
"модульная детская мебель с кроватью чердаком и диваном купить";9;61;13;13
"детская кровать чердак со столом и шкафом фото цена";9;51;84;12
"детская кровать чердак со шкафом и столом фото цена";9;51;83;12
"детская кровать чердак со столом и шкафом фото цена купить";10;58;67;53
"детская мебель кровать чердак с рабочей зоной фото и цены";10;57;38;34
"детские кровати чердаки для девочек от 3 лет с бортами";10;54;21;20
"детская кровать чердак купить в севастополе с доставкой по крыму";10;64;10;10
"фото детская кровать чердак со столом и шкафом фото цена купить";11;63;89;21
"детская кровать чердак со столом и шкафом фото цена купить авито";11;64;20;17
